id,user,text,date,bueno,malo,grosero,amable,cortés,descortés,agresivo,pasivo,neutral,match
1510673865403424777,sergio_fajardo,"Yo soy liberal y creo en las ideas liberales, pero el Partido Liberal no tiene ningún tipo de identidad si hoy César Gaviria se sienta a hablar con Petro o con Fico. Esa no es la política que nosotros representamos. @losdanieles",2022-03-04,0.0046606743708252,0.0029732841067016,0.0141549473628401,0.0065231337212026,0.0012662028893828,0.0823564976453781,0.0115226320922374,0.1201063245534896,0.7564363479614258,"['Petro', 'Fico']"
1510667382439968769,sergio_fajardo,"Representamos un proyecto político que apoya la paz, enfrenta la corrupción y rompe la polarización. Somos los que podemos transformar al país con cultura, educación y conocimiento. Vamos a poner en el centro a las mujeres y el medio ambiente. Somos diferentes a Petro y a Fico.",2022-03-04,0.0053222505375742,0.0022474960424005,0.0186899807304143,0.0425314009189605,0.0098528387024998,0.0231843404471874,0.0048878812231123,0.1249042600393295,0.7683795094490051,"['Petro', 'Fico']"
1508844203052261385,sergio_fajardo,Coincidimos con @ingrodolfohdez en que la lucha contra la corrupción es el principal problema que tiene Colombia. Nos sentamos a discutir sobre esta preocupación y cómo sacar a los corruptos del poder. Seguiremos conversando. ,2022-03-29,0.0073497397825121,0.0118515687063336,0.0442328937351703,0.0159794110804796,0.005038883537054,0.1021625250577926,0.0106929056346416,0.0308483969420194,0.771843671798706,['ingrodolfohdez']
1508477727594135563,sergio_fajardo,La metamorfosis de Isabel Zuleta y el todo vale de Petro ,2022-03-28,0.0033215307630598,0.0021460275165736,0.0254259407520294,0.0875383466482162,0.0411734916269779,0.5544812679290771,0.0227226950228214,0.1632061302661895,0.0999845340847969,['Petro']
1506964901272641543,sergio_fajardo,"Es sencillo: Si quiere que gane Petro, vote por Fico. Si quiere derrotar a Petro, entonces vote por Fajardo. @lafm",2022-03-24,0.0410254523158073,0.0008145509054884,0.0057831495068967,0.0401267707347869,0.2424054443836212,0.0099836410954594,0.0011591551592573,0.5276122689247131,0.1310895234346389,"['Petro', 'Fico', 'Petro']"
1506959911728594953,sergio_fajardo,"Decir que Fico representa el uribismo y a Duque no es atacarlo con mentiras. Es decir las cosas como son. Tengo más experiencia, una propuesta de gobierno seria y representamos un cambio sin continuismo, sin pactos con politiqueros. @lafm",2022-03-24,0.0020420746877789,0.0002407170977676,0.0009233690216206,0.439944177865982,0.0012909189099445,0.00419148709625,0.0009640313219279,0.058993924409151,0.4914093017578125,['Fico']
1506753908881899528,sergio_fajardo,"Nos quieren hacer creer que esto es entre Petro y Fico. ¡Están equivocados! Somos la alternativa del cambio con ilusión, con educación, empleos, seguridad. Lejos del todo vale y las alianzas con los mismos de siempre. Arrancó la remontada, acompáñanos.  ",2022-03-23,0.0065393503755331,0.4942575097084045,0.0072699040174484,0.0100590027868747,0.0008224949706345,0.1117305904626846,0.1420603841543197,0.0192441940307617,0.2080165594816208,"['Petro', 'Fico']"
1506730500097982474,sergio_fajardo,"A Petro hay que ganarle, pero sin reelegir a Duque y al uribismo. ",2022-03-23,0.0008121216087602,0.0011572501389309,0.0029881231021136,0.1197140216827392,0.0065481220372021,0.0420348234474659,0.032096654176712,0.0810724571347236,0.7135764360427856,['Petro']
1506072277032615945,sergio_fajardo,"He oído chistes malos y el de Fico de que soy vocero de Petro. Tal vez se lo pasaron por su celular durante el debate, pero realmente el chiste es muy malo. No soy vocero de nadie y voy a derrotar a Petro en 2da vuelta. Fico crece porque viene con esteroides del Gobierno y el CD. ",2022-03-22,0.0005306949024088,0.6591207981109619,0.048490285873413,0.0011703841155394,0.0003114137798547,0.1610220372676849,0.0610780902206897,0.0187722239643335,0.049504105001688,"['Fico', 'Petro', 'Petro', 'Fico']"
1506006119851954179,sergio_fajardo,"Gustavo: este es precisamente el momento en el que hay que debatir. Estamos en un punto crítico para Colombia y ahora, más que nunca, tenemos que exigir garantías y transparencia en el proceso electoral. ",2022-03-21,0.042848452925682,0.0305113270878791,0.0842812061309814,0.1398225724697113,0.0563584826886653,0.3307880461215973,0.0691630765795707,0.1126992926001548,0.1335276216268539,['Gustavo']
1505724635798716418,sergio_fajardo,"Duque cambió la ley para contratar en época electoral, promueve otra que limita la información que se entregue al próximo gobierno y  ahora su jefe, Alvaro Uribe, pone en duda las elecciones que ellos organizaron porque no les favorece. Y @FicoGutierrez callado. ",2022-03-21,0.0020518519449979,0.0033568916842341,0.0034918028395622,0.001977999927476,0.0032114891801029,0.0588435046374797,0.0084890322759747,0.9015424251556396,0.0170349851250648,['Fico']
1505515991085760512,sergio_fajardo,Fajardo es el único que le gana a Petro. ,2022-03-20,0.0061231316067278,0.0035125946160405,0.0784239098429679,0.0357980094850063,0.0072281858883798,0.51236492395401,0.0247054621577262,0.2506941258907318,0.0811496824026107,['Petro']
1504976904830529542,sergio_fajardo,Nos quieren hacer creer que ya es la segunda vuelta. ¡No es cierto! Vamos a demostrarle a Colombia que no estamos condenados a lo mismo. Elegir a Fico es reelegir a Duque. ,2022-03-19,0.0055731032043695,0.0108764367178082,0.0875219777226448,0.0078328102827072,0.0192533638328313,0.1707419902086258,0.5028584003448486,0.0860204622149467,0.1093214899301529,['Fico']
1504616594487615488,sergio_fajardo,Petro debe estar dichoso viendo cómo le montan a Fico de contendor porque sabe que le gana fácil en segunda vuelta. Nosotros somos la opción que puede enfrentar y ganarle a Petro. #ElDebateDeLasRegiones,2022-03-18,0.0182859655469656,0.0042420541867613,0.0120417354628443,0.6545515656471252,0.0080542601644992,0.034865353256464,0.1943936944007873,0.0376585721969604,0.0359068550169467,"['Petro', 'Fico', 'Petro']"
1503823564566405127,sergio_fajardo,"Financiar programas sociales con el ahorro pensional no solo compromete las pensiones futuras, también es injusto. Proponemos financiar el ingreso básico a las personas mayores con impuestos progresivos. Petro propone hacerlo con los ingresos futuros de la clase media. (2/6)",2022-03-15,0.001394854276441,0.7454153895378113,0.0157245583832263,0.0036350390873849,0.0096307285130023,0.127326488494873,0.0188954267650842,0.0372938066720962,0.04068373888731,['Petro']
1503823562729213956,sergio_fajardo,Petro tomó nuestra propuesta de garantizar un ingreso de $500.000 a los adultos mayores sin pensión. Me preocupa que vaya a financiarlo con los ahorros de los colombianos en los fondos privados. (1/6) ,2022-03-15,0.011050222441554,0.0094621973112225,0.0760739296674728,0.0253296829760074,0.0694323405623436,0.117890290915966,0.112063243985176,0.3350321054458618,0.2436659336090088,['Petro']
1500570957429231618,sergio_fajardo,"Moisés Wasserman, Juan Gabriel Vásquez y Gustavo Bell simbolizan el rigor intelectual y la creatividad en tres mundos: académico, cultural y público. Estoy orgulloso de tener su apoyo. Con personas inspiradoras como ellos cambiaremos el país. Primer paso: votar el 13 de marzo. ",2022-06-03,0.5936013460159302,0.001829981454648,0.011904276907444,0.2425947487354278,0.0119206486269831,0.0084463385865092,0.002512548584491,0.0738894119858741,0.0533006712794303,['Gustavo']
1499419527595053062,sergio_fajardo,"Muchas gracias a Gustavo Bell por su apoyo y confianza. Con él y otras muchas personas más trabajaremos para hacer que el Caribe brille por su talento, la calidad de su educación, su riqueza cultural y su gente. ",2022-03-03,0.0054005025885999,0.0006826762692071,0.0191723965108394,0.8764245510101318,0.0038991561159491,0.0238899309188127,0.0024558485019952,0.0401384346187114,0.0279364418238401,['Gustavo']
1499403168085688322,sergio_fajardo,"Duque cantó su voto y ratifica que el 13 de marzo la elección es entre el equipo duquista, el Pacto Histórico donde Petro ningunea a sus compañeros para abrazarse con políticos de siempre y nosotros, que somos la alternativa del cambio serio que va de frente contra los corruptos. ",2022-03-03,0.0191485676914453,0.0121286399662494,0.0301222316920757,0.0578332096338272,0.0157177224755287,0.1015779599547386,0.1342514753341674,0.1836161315441131,0.4456040263175964,['Petro']
