id,user,text,date,bueno,malo,grosero,amable,cortés,descortés,agresivo,pasivo,neutral
1589359721579892736,petrogustavo,@ElHuffPost @MILA_fernandez5 .,06-11-2022,0.010504689998924732,0.032149434089660645,0.03113299235701561,0.062013350427150726,0.06846771389245987,0.08365844935178757,0.02283116802573204,0.27862295508384705,0.4106192886829376
1589017929706004481,petrogustavo,"Firmo el tratado de Escazú, ya es ley de la República.

Poder a la ciudadanía para defender la Vida y la Naturaleza. ",05-11-2022,0.016395749524235725,0.004179046489298344,0.02470238134264946,0.173823744058609,0.03551102057099342,0.12694254517555237,0.014213637448847294,0.31122666597366333,0.29300522804260254
1588998256394383361,petrogustavo,"Continua la reforma Agraria, ahora en el Meta. ",05-11-2022,0.0019374840194359422,0.00254356162622571,0.049578163772821426,0.011457575485110283,0.018928702920675278,0.6801732182502747,0.015287508256733418,0.06921137869358063,0.15088234841823578
1588995933471064065,petrogustavo,"Ahora me dirigo a la COP27: la reunión de todo(a)s los presidentes del mundo para tonar medidas frente al peor problema de la humanidad y el que puede acabar con ella: el cambio climático producido por la economía fósil

",05-11-2022,0.022599760442972183,0.31198424100875854,0.08059296756982803,0.02254546992480755,0.025228800252079964,0.2685089707374573,0.09858296811580658,0.05258432403206825,0.11737246066331863
1588913036651528193,petrogustavo,Un saludo especial a la @PoliciaColombia por sus 131 años. Velar por la seguridad y los derechos de los ciudadanos serán los principios básicos de la institución. Llevaremos educación y oportunidades a cada uno de los patrulleros y policías del país.,05-11-2022,0.00906237680464983,0.003318369621410966,0.013143680989742279,0.7934392690658569,0.01022889744490385,0.006036730483174324,0.003337978385388851,0.0755944699048996,0.08583822101354599
1588854853996253184,petrogustavo,"Invito a todos los gobiernos latinoamericanos y del mundo a llamar a por poner fin a la guerra e iniciar negociaciones de paz.

El mundo necesita la Paz. ",05-11-2022,0.0029480697121471167,0.01634497195482254,0.012604326009750366,0.5551918745040894,0.004107417538762093,0.030093368142843246,0.2338794320821762,0.0712069496512413,0.07362356036901474
1588708405728153601,petrogustavo,"En el año 2015, el metro subterraneo de Bogotá, hasta la calle 127, costaba 14 billones de pesos hoy ese mismo tramo cuesta 35 billones de pesos. 

Ese es el costo de la mezquindad política.",05-11-2022,0.0023694410920143127,0.00967382825911045,0.06478128582239151,0.0020290890242904425,0.006985121872276068,0.4269562065601349,0.10830811411142349,0.3590322732925415,0.01986464485526085
1588708401269202944,petrogustavo,Ningun contratista puede abrogarse el derecho unilateral de parar desde un satelite 9 carros al servicio de la seguridad de líderes sociales rompiendo las claúsulas contractuales. ,05-11-2022,0.004231428727507591,0.00480217020958662,0.014295226894319057,0.10483744740486145,0.006486091297119856,0.20618708431720734,0.11850947141647339,0.12858319282531738,0.41206786036491394
1588696759060279297,petrogustavo,Firmada la ley de Paz. ,05-11-2022,0.0032840054482221603,0.00138279574457556,0.00850818119943142,0.4459180533885956,0.0019346256740391254,0.02586539275944233,0.0013310404028743505,0.07028045505285263,0.4414953887462616
1588612485694644224,petrogustavo,"Reunido en Hato Grande, Cajicá, con más de 100 funcionarios del más alto nivel en la primera Asamblea General de Gobierno. ",04-11-2022,0.006638297811150551,0.0032212557271122932,0.04297656938433647,0.042509883642196655,0.007785983383655548,0.509787380695343,0.021653395146131516,0.17878687381744385,0.18664036691188812
1588608565870493696,petrogustavo,"Festejamos y premiamos a nuestras campeonas mundiales de fútbol de salón.

Mujeres poderosas. ",04-11-2022,0.035285621881484985,0.003311512293294072,0.05811995640397072,0.2106640487909317,0.017341382801532745,0.0770174115896225,0.023281875997781754,0.42567184567451477,0.1493062525987625
1588603363121586176,petrogustavo,Campeonas mundiales: Selección Colombia Femenina de Fútbol de Salón. ,04-11-2022,0.007003275211900473,0.003175007412210107,0.02245679497718811,0.036041390150785446,0.011374355293810368,0.07689816504716873,0.02300037071108818,0.5688020586967468,0.25124862790107727
1588528773242421248,petrogustavo,,04-11-2022,0.0,0.0,0.0,0.0,0.0,0.0,0.0,0.0,0.0
1588526515884785664,petrogustavo,La reforma tributaria no tiene nada que ver con la ropa importada. Es bueno leerla. ,04-11-2022,0.35705462098121643,0.000267914729192853,0.001909460755996406,0.2931264638900757,0.0003977637679781765,0.024998441338539124,0.00041371790575794876,0.10502798855304718,0.21680361032485962
1588344962416275456,petrogustavo,"Felicitaciones al ministro de hacienda, José Antonio Ocampo, y al director de la Dian, Luis Carlos Reyes, por un trabajo que no puede ser calificado más que de excelente. ",04-11-2022,0.8166215419769287,0.0006449178326874971,0.002056211931630969,0.1258392333984375,0.0029777686577290297,0.003075832035392523,0.0006628379342146218,0.0037159486673772335,0.044405654072761536
1588337050641637378,petrogustavo,"Las regalías no son un costo de producción de las empresas mineras.

Las regalías son un derecho de la nación; a cambio de ellas, el estado permite que un particular explote comercialmente los bienes que le pertenecen a la nación en el subsuelo. ",04-11-2022,0.0031522815115749836,0.00245085172355175,0.004117573145776987,0.011071432381868362,0.0011112276697531343,0.05032617226243019,0.0030989148654043674,0.2772996425628662,0.6473719477653503
1588333120402558976,petrogustavo,"Se respetrán lderechos de los actuales trabajadores de ""Drogas la Rebaja""

El programa de salud preventiva no exigirá afiliacion a EPS, ni discriminará a nadie. Buscará prevenir la enfernedad y lograr salvar vidas que hoy el régimen de salud ineficiente no logra hacer.",04-11-2022,0.003192515578120947,0.002044606488198042,0.005796775687485933,0.06645484268665314,0.0030383197590708733,0.01345150452107191,0.0031430304516106844,0.07906180620193481,0.8238165974617004
1588332996502986752,petrogustavo,"Los equipos médicos necesitarán 10.000 centros d atención primaria que el gobierno instalará

Transformaremos cada farmacia en Centros de atención primaria, y sus laboratorios serán la primera industria nacional de producción de vacunas y medicamentos genéricos",04-11-2022,0.00958588533103466,0.0054200501181185246,0.02787453681230545,0.028623582795262337,0.010069876909255981,0.030305173248052597,0.010351544246077538,0.7405895590782166,0.13717974722385406
1588328977470717952,petrogustavo,"Empezamos con mil equipos médicos que se extenderán a 20.000 en todo el país para cubrir 5 millones de familias

Cada equipo estara compuesto de un medico(a), un sicológo(a), enfermera(o), y 8 a 10 auxiliares de enfermería

Los equipos visitarán al menos 3 veces al año cada hogar ",04-11-2022,0.017217783257365227,0.004625137895345688,0.02784290537238121,0.06243029981851578,0.008848810568451881,0.14442655444145203,0.014627454802393913,0.45654457807540894,0.2634364366531372
1588328080275542017,petrogustavo,Devolvimos los hospitales intervenidos por el anterior gobierno a Santa Marta y al Magdalena. ,04-11-2022,0.0036778952926397324,0.0013705346500501037,0.010806551203131676,0.01115780882537365,0.016265327110886574,0.16785666346549988,0.02917182259261608,0.7331740856170654,0.026519309729337692
1588319605222957056,petrogustavo,La sobretasa al impuesto de renta de las generadoras eléctricas por ganancias extraordinarias no la pagarán los usuarios. La CREG tiene la orden legal de impedirlo. ,03-11-2022,0.0058244927786290646,0.008006429299712181,0.06525857001543045,0.02129756100475788,0.00773391081020236,0.42472103238105774,0.0403343103826046,0.1035185307264328,0.3233051300048828
1588318041405681664,petrogustavo,"Hilary fue activista en mi campaña presidencial, y fué abusada sexualmente en una estacion de transmilenio. Le solicito a la policía en la la brevedad del tiempo la captura del criminal. ",03-11-2022,0.0028806498739868402,0.05157262831926346,0.00964330229908228,0.0012006387114524841,0.004580977372825146,0.10809705406427383,0.8139877319335938,0.004556071013212204,0.003480958053842187
1588270328387706881,petrogustavo,"En Aracataca, Magdalena. Damos inicio a nuetro modelo de salud nacional. La salud preventiva y los equipos médicos en territorio ",03-11-2022,0.021047063171863556,0.006594768259674311,0.09677708148956299,0.09035420417785645,0.02732531726360321,0.15925416350364685,0.020556993782520294,0.2672514021396637,0.3108390271663666
1588232590292811776,petrogustavo,"María Gaitán Valencia, será la directora del centro de memoria histórica ",03-11-2022,0.006739477161318064,0.0019198806257918477,0.035800445824861526,0.024249443784356117,0.012475239112973213,0.7079626321792603,0.0170951709151268,0.05952128395438194,0.1342363804578781
1588154426379931649,petrogustavo,.@RoyBarreras un mensaje de apoyo en su enfermedad y de felicitación por su excelente trabajo al dirigir la aprobación en el senado de la reforma tributaria. La reforma que busca mayor justicia social en Colombia.,03-11-2022,0.4563099443912506,0.0015259551582857966,0.0029459353536367416,0.49283143877983093,0.0018815812654793262,0.0037781517021358013,0.0006160929915495217,0.015563844703137875,0.024547094479203224
1588147086024794115,petrogustavo,"Le solicito a toda empresa en Colombia establecer el criterio: ""a trabajo igual, salario igual para hombres y mujeres"". ",03-11-2022,0.005237601697444916,0.002747633494436741,0.0069463299587368965,0.051655881106853485,0.07295107841491699,0.023028478026390076,0.005458894185721874,0.1978261023759842,0.6341480016708374
1587973330304393223,petrogustavo,"Ni lo propusimos, ni lo tumbamos. ",03-11-2022,0.003197711193934083,0.004372132942080498,0.017415989190340042,0.14792458713054657,0.04771791771054268,0.5819429159164429,0.012054278515279293,0.16944479942321777,0.015929734334349632
1587962875238354945,petrogustavo,"Lograr 100.000 mejoramientos de vivienda al año, en los barrios con necesidades basicas insastifechas de las ciudades, es un buen generador de empleo y de satisfacción famliar.

Aqui en la comunidad del Pozón en Cartagena ",03-11-2022,0.7859779596328735,0.0005271782865747809,0.0030374424532055855,0.10832013934850693,0.00526023143902421,0.003204609267413616,0.00033855863148346543,0.04331858828663826,0.05001522973179817
1587933738826366976,petrogustavo,"Este es el programa ""Cambia mi Casa"" que se hace con albañiles y tiene como beneficiarios a familias de barrios populares con baja calidad en sus viviendas.

Si invertimos un billón anual, es dinero para la economía popular y para mejorar la vida de las familias humildes. ",02-11-2022,0.012680234387516975,0.005855257622897625,0.02695101499557495,0.08207912743091583,0.03439104184508324,0.048879921436309814,0.007765654474496841,0.3195360004901886,0.4618617296218872
1587932403011502082,petrogustavo,"Este arancel a lan mportación de confecciones permitirá que pueda dispararse la industria de confecciones de Colombia.

Mejor aun si frenamos el gran contrabando que es la otra cara de la moneda de la exportación de cocaína ilegal. ",02-11-2022,0.010784226469695568,0.007077627349644899,0.04917393624782562,0.37532496452331543,0.01554101426154375,0.19849595427513123,0.0265063364058733,0.12105334550142288,0.19604261219501495
1587859138977013761,petrogustavo,"La igualdad de la mujer y el hombre. La lucha contra la discriminación. El deporte atado al conocimiento, el abrir las oportunidades a la juventud es el propósito central del gobierno. ",02-11-2022,0.019120698794722557,0.019325125962495804,0.13687872886657715,0.11643283814191818,0.01811852864921093,0.08325710147619247,0.016158858314156532,0.2939354181289673,0.2967725992202759
1587854575637336064,petrogustavo,"Antes de prender cualquier turbina en Hidroituango debe evacuarse la población en riesgo como medida de precaución que es un principio universal.

En el gobierno del cambio por la vida es primero la vida.",02-11-2022,0.00668826699256897,0.007332226261496544,0.017658771947026253,0.11671624332666397,0.010807923041284084,0.044498249888420105,0.010487985797226429,0.1595524549484253,0.6262578368186951
1587850504788385794,petrogustavo,"Excelente artículo de monseñor  Barreto.

El verdadero Pacto Social consiste en que los más afortunados económicamente paguen sus impuestos sabedores que con ellos se construye la dignidad humana y la paz.

",02-11-2022,0.8621002435684204,0.0008062056149356067,0.0004988820292055607,0.09939791262149811,0.00048080520355142653,0.0006930032977834344,0.0005308006075210869,0.01065922249108553,0.02483285591006279
1587849570167537665,petrogustavo,"Había que detener el fascismo y aqui se muestra. La derecha latinoamericana debe aislar este extremismo criminal que destruye el proyecto democratico común.

Siempre que la razón esté presente, será posible el dialogo y el entendimiento humano. ",02-11-2022,0.03780616819858551,0.013728507794439793,0.0012996604200452566,0.001724471221677959,0.001399016473442316,0.02209237404167652,0.9092857241630554,0.004479288589209318,0.00818475428968668
1587815591192236032,petrogustavo,"Con la selección Colombia femenina sub 17 subcampeona mundial.

Hablamos sobre lo que significa la discriminación de la mujer en la sociedad colombiana y la lucha por la igualdad. ",02-11-2022,0.016842860728502274,0.022942043840885162,0.08857714384794235,0.025773625820875168,0.08728653192520142,0.3305082619190216,0.11850238591432571,0.22286836802959442,0.08669883012771606
1587614618330988544,petrogustavo,Declaración conjunta de los presidentes de la República Bolivariana de Venezuela y de la República de Colombia. ,02-11-2022,0.009569828398525715,0.006795662455260754,0.020795593038201332,0.03743328899145126,0.02372032403945923,0.13077886402606964,0.019278518855571747,0.5750470757484436,0.1765807718038559
1587467645196058624,petrogustavo,Así va el dialogo regional en Villavicencio. ,01-11-2022,0.12362288683652878,0.005446468945592642,0.041208889335393906,0.08755555748939514,0.025504525750875473,0.2506493628025055,0.010153114795684814,0.1578318327665329,0.2980274558067322
1587426381453004801,petrogustavo,"Lo que aquí es considerado una equivocación, se impone en el mundo como una necesidad ",01-11-2022,0.0006175683229230344,0.02755233272910118,0.008954763412475586,0.001256671268492937,0.000412260415032506,0.9468502998352051,0.007267461623996496,0.004675053525716066,0.0024136060383170843
1587170265175363585,petrogustavo,"He hablado telefónicamente con el presidente @LulaOficial. Le extendí mi más sincera felicitación. 

""Las relaciones entre Colombia y Brasil serán estrechas porque ambos amamos la Amazonia"", me dijo. Así será presidente Lula.",31-10-2022,0.029081173241138458,0.001021705218590796,0.015993453562259674,0.6927997469902039,0.005991775542497635,0.023806586861610413,0.00372734060510993,0.15248434245586395,0.07509391009807587
1587161967785041923,petrogustavo,"Con los alcades y alcaldesas de las capitales de Colombia, en los 10 años de asocapitales, asociacion que fundé desde mi alcaldía de Bogotá.

Hablé de la emergencia climática el hambre y el nuevo urbanismo y la movilidad eléctrica que debemos alcanzar ",31-10-2022,0.015327591449022293,0.009462724439799786,0.058352578431367874,0.06844303011894226,0.015501178801059723,0.13281048834323883,0.016745612025260925,0.36329370737075806,0.32006314396858215
1587105110563381249,petrogustavo,"Esta es la variable fundamental y más importante de la economía. El volumen de puestos de trabajo que se generen.

La politica anticíclica del gobierno, frente al estancamiento económico mundial, debe ser propugnar porque los puestos de trabajo crezcan 
 ",31-10-2022,0.030636966228485107,0.010072632692754269,0.05192408338189125,0.0624069981276989,0.007519746199250221,0.059854522347450256,0.04678621143102646,0.06721226871013641,0.6635866165161133
1587090159333523458,petrogustavo,"El 60% de las solicitudes de restitución hechas por víctimas a las que despojaron de sus bienes y tierras fueron respondidas negativamente por el Estado, aduciendo que allí iban proyectos mineros o que debían contar con el visto bueno del ministerio de defensa",31-10-2022,0.005838420707732439,0.007850291207432747,0.010428878478705883,0.01359787117689848,0.0138694504275918,0.048210956156253815,0.029392478987574577,0.7132209539413452,0.15759073197841644
1587090157760561153,petrogustavo,"La hacienda Támesis que entregué a los campesinos el sábado siguió haciendo las mismas transacciones financieras y negocios que tenía Carlos Castaño pero bajo la administración del Estado.

Bajo el Estado o bajo Castaño era un nodo de negocios paramilitares.",31-10-2022,0.005118659697473049,0.004684509243816137,0.012715456075966358,0.01671413518488407,0.008819724433124065,0.04112466424703598,0.010208594612777233,0.7712824940681458,0.1293317675590515
1587079077353197570,petrogustavo,"Temas de una agenda con Brasil:

1. El rescate de la selva amazónica y su investigación científica.
2. El camino de una nueva política antidrogas no violento.
3. La red integrada de energía eléctrica de América con energías límpias
4. La integración económica latinoamericana",31-10-2022,0.010831541381776333,0.00914050918072462,0.09268353134393692,0.09470808506011963,0.024551959708333015,0.09528765082359314,0.02166379988193512,0.20199893414974213,0.449133962392807
1587062739066912768,petrogustavo,El principio de repetición tiene un fundamento esencial: El cumplimiento cabal de Estado a su palabra en los acuerdos. ,31-10-2022,0.01293246541172266,0.0064086285419762135,0.015559366904199123,0.029230773448944092,0.007289115805178881,0.039391618221998215,0.007820175029337406,0.18073606491088867,0.7006317973136902
1587061576548458497,petrogustavo,Esta es la carta que he recibido de Salvatore Mancuso alrededor de la evaluación de su proceso de paz y nuestra propuesta de Paz total. ,31-10-2022,0.008482672274112701,0.006123390514403582,0.01464035827666521,0.047623682767152786,0.040542423725128174,0.12284272909164429,0.017430927604436874,0.1528223305940628,0.5894914865493774
1586883837191065600,petrogustavo,Felicitaciones. Somos campeones mundiales de fútbol de salón femenino y subcampeones mundiales de fútbol femenino. ,31-10-2022,0.10123103111982346,0.002032447373494506,0.007334639318287373,0.5569792985916138,0.024878090247511864,0.009593463502824306,0.007920662872493267,0.21185462176799774,0.07817565649747849
1586846806171860993,petrogustavo,Viva Lula.,30-10-2022,0.02050936594605446,0.011315698735415936,0.04119453206658363,0.24684979021549225,0.01507753599435091,0.1905914843082428,0.055146582424640656,0.2671705484390259,0.15214446187019348
1586760833354403840,petrogustavo,Gracias a las jugadoras de la Selección Colombia que nos llenan el corazón de orgullo y admiración. Que esta sea la oportunidad para que como sociedad nos comprometamos con la profesionalización de todos los y las deportistas. ¡Somos subcampeones del mundo!,30-10-2022,0.04284133389592171,0.0007138139335438609,0.004971801303327084,0.8607964515686035,0.011776382103562355,0.005570828914642334,0.0022650037426501513,0.03312995657324791,0.03793451189994812
1586728167691223045,petrogustavo,"¡Buena suerte a nuestras chicas superpoderosas! 

Todo un país lleno de orgullo de verlas hoy en la cancha.",30-10-2022,0.02516571246087551,0.0020267919171601534,0.012575621716678143,0.8861954212188721,0.001188297988846898,0.023889876902103424,0.0075766947120428085,0.0158198494464159,0.025561679154634476
1586502516174307328,petrogustavo,"Que Brasil haga brillar la luz de latinoamerica. Hay quienes dicen que no existe el fascismo. Está en cada uno de nosotros. Se detiene adentro y afuera.  Si queremos más dias para la humanidad, el fascismo debe ser detenido. ",29-10-2022,0.08667262643575668,0.019527137279510498,0.03401108458638191,0.23370137810707092,0.013791484758257866,0.1726648360490799,0.01729006879031658,0.1686902642250061,0.2536511719226837
1586486530578825216,petrogustavo,¿Qué cosa es esta? ¿desde cuando apoyo invasiones?  No apoyo ni esta ni ninguna de las que se han producido en el siglo XX. No apoyo ninguna invasión. ,29-10-2022,0.0004092422022949904,0.0061737303622066975,0.00456976518034935,0.0005275614676065743,0.000262528657913208,0.04081349074840546,0.16867268085479736,0.20647504925727844,0.5720958709716797
1586482396039241729,petrogustavo,"Claro que todo el Caribe debe hablar de la energia eléctrica, de por qué las tarifas ya no permiten comer, de por qué avanza el hambre y los jóvenes pobres se matan con jóvenes pobres.

En el fondo la causa del problema está en un poser estatal que se deja cooptar de las mafias ",29-10-2022,0.012811413034796715,0.09909617155790329,0.015696940943598747,0.005408755503594875,0.0028023694176226854,0.11220889538526535,0.3463541269302368,0.3087116479873657,0.09690973162651062
1586466991279603713,petrogustavo,Ahora en Barranquilla impulsando el dialogo regional para construir el plan de todos y todas las colombianas ,29-10-2022,0.016223041340708733,0.009438058361411095,0.10685374587774277,0.17349916696548462,0.014503207989037037,0.32445207238197327,0.014693764969706535,0.055620674043893814,0.28471633791923523
1586454999185358848,petrogustavo,"Luego los que por fin pasaron a la etapa judicial quedaron esperando el fallo. 5.500.000 hectareas de tierra de afros, indígenas y personas individuales víctimas de la violencia estan manos de jueces desde hace años y esperan que le devuelvan sus tierras despojadas",29-10-2022,0.005003029014915228,0.008522999472916126,0.028303170576691628,0.010936575010418892,0.022271903231739998,0.06571651250123978,0.799811065196991,0.0439465306699276,0.015488331206142902
1586454996773634053,petrogustavo,"Rechazaron el 60% de las slicitudes  de las víctimas que pedían la devolución de sus tierras con la excusa de que allí habían proyectos mineros.

A los que superaron la prueba quedaron bajo el visto bueno que debía dar el mindefensa. ",29-10-2022,0.008211961947381496,0.019519416615366936,0.038499001413583755,0.009548665024340153,0.010634137317538261,0.1028323546051979,0.21367371082305908,0.33784955739974976,0.25923117995262146
1586410506742812672,petrogustavo,"Entrego la finca que ocupó Carlos Castaño cerca de Monteria a 50 familias campesinas.

Aqui comienza la reforma agraria. ",29-10-2022,0.02230609580874443,0.0009334273054264486,0.01464043278247118,0.4840014576911926,0.002978555392473936,0.34503230452537537,0.006052754353731871,0.058973029255867004,0.06508192420005798
1586405633636515840,petrogustavo,Solicitud a los marchantes de hoy. Todo medio de comunicación tiene el derecho de cubrir e informar. No obstaculicen la libertad de prensa. ,29-10-2022,0.004500873386859894,0.00139186333399266,0.002123536542057991,0.32462701201438904,0.001850516302511096,0.013474849052727222,0.003560513723641634,0.12396988272666931,0.5245009660720825
1586170190882119680,petrogustavo,"Alexis, es un colombiano que ha muerto en el Donbás; sus ideas revolucionarias, quizás equivocadas, quizás no, lo llevaron a esta guerra con los ojos abiertos.

Ha muerto un joven que quizo ser revolucionario. La revolución es la Paz.

Esto no saldrá en nuestros medios. ",29-10-2022,0.0014581424184143543,0.01215923298150301,0.02825997769832611,0.0016749817878007889,0.002364251995459199,0.3260875642299652,0.48176053166389465,0.08637573570013046,0.059859611093997955
1586149656949854208,petrogustavo,"Saul Kattan logró subir el valor de ETB de manera sustancial en mi alcaldía.

Hoy tiene el reto de dirigir como presidente de la junta directiva y en nombre de la mayoría accionaria, de propiedad pública, el incremento de valor de la empresa más grande de Colombia: Ecopetrol ",29-10-2022,0.03219694271683693,0.005717793945223093,0.04476526752114296,0.030097121372818947,0.025763746351003647,0.1316448599100113,0.015471449121832848,0.5408496856689453,0.17349320650100708
1586076291677458432,petrogustavo,"En Bosconia, Cesar, en el puesto de mando unificado para tomar acciones ante los desastres climáticos. ",28-10-2022,0.02776349149644375,0.013221746310591698,0.10812167823314667,0.16312843561172485,0.035000160336494446,0.15098534524440765,0.01921267993748188,0.10533992201089859,0.3772265315055847
1586063394431717376,petrogustavo,"3. Siempre se respetará el derecho de los accionistas minoritarios.

4. La directriz del presidente de la República para la acción de sus representantes en la nueva junta directiva, es elevar el Valor de Ecopetrol",28-10-2022,0.009504972957074642,0.004674945026636124,0.00929549615830183,0.1058935821056366,0.017207249999046326,0.040230702608823776,0.004631419200450182,0.2873736023902893,0.5211880207061768
1586063382461165568,petrogustavo,"1. Ecopetrol configura como cualquier otra empresa su junta directiva de acuerdo a la participación accionaria, la mayoría de acciones es del Estado

2. La nueva junta directiva está conformada por personas que ya han aumentado el valor de empresas como EEB y ETB.",28-10-2022,0.007553229574114084,0.0042476230300962925,0.011132496409118176,0.009307397529482841,0.06928149610757828,0.027452360838651657,0.003850317792966962,0.41060471534729004,0.4565703868865967
1585733692873670656,petrogustavo,"Ahora , en Arauca ",27-10-2022,0.0041151936165988445,0.0037840513978153467,0.13004329800605774,0.05121679604053497,0.017312077805399895,0.3621924817562103,0.029705943539738655,0.18770959973335266,0.21392059326171875
