id,user,text,date,bueno,malo,grosero,amable,cortés,descortés,agresivo,pasivo,neutral
1535248404279869441,petrogustavo,"En este éxodo para llegar a EEUU van miles de colombianos. Se van porque aquí no hay oportunidades para ellos. 

El cambio real consiste en abrirle las oportunidades de la vida, del conocimiento y del trabajo a toda nuestra población ",10-06-2022,0.015324769541621208,0.28738123178482056,0.04590367525815964,0.0481729581952095,0.06011878699064255,0.14336809515953064,0.034653693437576294,0.23365500569343567,0.13142171502113342
1535105189056811020,petrogustavo,Así manipulan a los creyentes los grupos que dicen apoyar a Rodolfo ,10-06-2022,0.0022896674927324057,0.027801817283034325,0.07811739295721054,0.0033899606205523014,0.0038100460078567266,0.41144755482673645,0.444877952337265,0.014292166568338871,0.013973472639918327
1535096754085011481,petrogustavo,"Si tienen todas las grabaciones ilegales de mi campaña desde hace nueve meses ¿por qué no aparece las grabaciones donde afirmo que voy a expropiar?

¿Raro no?",10-06-2022,0.010872060433030128,0.034274935722351074,0.06134243309497833,0.04076924920082092,0.019021203741431236,0.2542809844017029,0.22525203227996826,0.2762194871902466,0.07796759903430939
1535079601038163968,petrogustavo,"Aún con este nivel de calumnia a la que han llegado, el día después de mi posesión, tanto el Centro Democrático, como Federico y Rodolfo serán invitados a discutir los proyectos de transformación de Colombia y a buscar el gran acuerdo Nacional para construir la Paz de Colombia. ",10-06-2022,0.0008196464041247964,0.4553249180316925,0.14409472048282623,0.0005345474928617477,0.00017831441073212773,0.06785736232995987,0.3224492073059082,0.003957280423492193,0.004783887416124344
1535077131562397697,petrogustavo,¿Usted sabe lo que pasará en Colombia con este tipo de personas?. La guardia de asesores censuran a la prensa en esta entrevista. ,10-06-2022,0.002974828239530325,0.011988581158220768,0.03257109597325325,0.006662081927061081,0.004752431996166706,0.5770659446716309,0.21393585205078125,0.11447422206401825,0.03557495027780533
1535075987439792128,petrogustavo,"Mientras recibíamos el peor ataque a la campaña. la grabación de las reuniones privadas desde el mes de Octubre de toda la militancia, así me defendía. ",10-06-2022,0.00020678223518189043,0.3763220012187958,0.021191710606217384,0.0004331233794800937,0.00030153413536027074,0.010178228840231895,0.5850470066070557,0.0050842068158090115,0.0012354819336906075
1535074749768155137,petrogustavo,Esta sí es la campaña de difamación que montaban mis contradictores. Con centenares de millones de pesos le entregaban esta difamación a millones de personas ,10-06-2022,0.000708945095539093,0.004634537734091282,0.02163686789572239,0.00041547653381712735,0.0008997934637591243,0.0399780310690403,0.9291940331459045,0.001655283267609775,0.0008769608684815466
1535074003492433920,petrogustavo,"Si tiene todas las grabaciones desde el año pasado de nuestras conversaciones internas, y solo una entidad poderosa pudo hacerlo, ¿cómo es que no aparece que yo iba a quemar iglesias como le dijeron a millones de personas o que yo era un corrupto?

¿Raro no?",10-06-2022,0.005068368278443813,0.007877511903643608,0.00953785702586174,0.008839377202093601,0.00569401727989316,0.061646681278944016,0.03192424029111862,0.7698066830635071,0.09960529208183289
1535046204664446982,petrogustavo,"Si tienen todas las grabaciones de nuestras conversaciones internas por decenas de horas y durante meses, ¿por qué será que no sale nada que reafirme que me voy a volver un dictador y a reelegir mi mandato?

¿Raro no?",09-06-2022,0.023645855486392975,0.027688514441251755,0.0821862742304802,0.013619460165500641,0.03937619552016258,0.2327749878168106,0.40858930349349976,0.1301461011171341,0.041973307728767395
1535029914440814597,petrogustavo,"Tienen todas nuestras conversaciones internas grabadas y en manos de la prensa. ¿ por qué sera que no sale nada que reafirme que vamos a volver a Colombia como Venezuela?

¿Raro no?",09-06-2022,0.0029286921489983797,0.004682523664087057,0.02220756560564041,0.006751747336238623,0.01570769213140011,0.16845712065696716,0.012109740637242794,0.7218105792999268,0.04534434154629707
1535012811495071764,petrogustavo,"Ven y debates conmigo en televisión. Le decimos a Vicky que te entregue todas las horas de grabación que tiene y me muestras un solo delito mio, si lo haces renuncio a mi campaña y ganas.

El enjuiciado es usted, tienes la oportunidad de equilibrar la carga. Ven a debatir. ",09-06-2022,0.01010611280798912,0.005196915008127689,0.013534165918827057,0.20967434346675873,0.015986185520887375,0.056288957595825195,0.06328611075878143,0.33113768696784973,0.29478952288627625
1535002348380205057,petrogustavo,Esta es mi propuesta a las personas en condición de discapacidad ,09-06-2022,0.054382383823394775,0.02066110633313656,0.06671342253684998,0.24698375165462494,0.03310202807188034,0.3004191815853119,0.024907659739255905,0.08912846446037292,0.16370193660259247
1534961569418858523,petrogustavo,"Si es por seguridad y lo comprendo porque he vivido décadas bajo amenaza y más en la presente campaña, lo invito a la seguridad de dar los debates por televisión. El pueblo se merece los debates y usted tendrá la máxima seguridad. ",09-06-2022,0.0068933856673538685,0.005167781375348568,0.010295195505023003,0.7026715278625488,0.00726447394117713,0.013100539334118366,0.00633624754846096,0.2149513065814972,0.03331954777240753
1534959910194135042,petrogustavo,Esta es una mentira. En esa reunion ante la evidencia que sectores de la.prensa nos iban a atacar diciendo que proponíamos un pacto con extraditables sale es el rechazo total ante tamaño infundio. Este es el efecto de editar nuestras reuniones. ,09-06-2022,0.00019024196080863476,0.36796504259109497,0.09492381662130356,0.00023759870964568108,0.00016079658234957606,0.2266535609960556,0.2965710163116455,0.01188639272004366,0.0014114651130512357
1534958271005696000,petrogustavo,"Si mi contrincante tiene temor que atenten contra él, como lo hemos tenido nosotros sin frenar nuestras manifestaciones, Lo invito a dar el debate en un lugar seguro. Lo invito a loa debates por television. El pueblo se lo merece. ",09-06-2022,0.041319459676742554,0.0018903820309787989,0.0035264461766928434,0.7512529492378235,0.001038490328937769,0.012258448638021946,0.1308053433895111,0.032946426421403885,0.024962060153484344
1534955800673898497,petrogustavo,Le solicito a todas las organizaciones de derechos humanos que se inicie investigación sobre como es posible que se haya grabado ilegalmente desde la plataforma de Colombia Humana todas las conversaciones de sus miembros.,09-06-2022,0.016780944541096687,0.2095971703529358,0.0701555386185646,0.04596591740846634,0.026001596823334694,0.35228562355041504,0.1418294906616211,0.08429719507694244,0.053086522966623306
1534955799021334529,petrogustavo,Le solicito a la prensa que esta anunciando que sabiamos de antemano qie miembros del pacto irian a cárceles que miren las fechas de los videos y le digan a la opinión pública que hablamos es de defendernos de un ataque mentiroso despues que la prensa lo hizo público,09-06-2022,0.004227313678711653,0.009903084486722946,0.008114880882203579,0.0379815548658371,0.02026202715933323,0.08286747336387634,0.6811947822570801,0.1254897117614746,0.02995913103222847
1534955797276512256,petrogustavo,Le solicito a Vicky que saque una sola grabación mia en mis reuniones internas de las cuales posee todas las grabaciones donde indique o cometa un delito. Estoy dispuesto.a renunciar a mi campaña si eso sucede.,09-06-2022,0.003935021348297596,0.009502596221864223,0.060977283865213394,0.6023117899894714,0.009543508291244507,0.068876251578331,0.08993759751319885,0.07938104122877121,0.07553481310606003
1534954070741504002,petrogustavo,Alfred Santamaria era el socio en un consejo directivo de una fundación de su propiedad de la persona que pagó a los grupos de mercenarios que mataron almpresidente de Haití. ,09-06-2022,0.0063225929625332355,0.0092778904363513,0.03785267844796181,0.012087695300579071,0.053100068122148514,0.29193753004074097,0.14630144834518433,0.39817893505096436,0.04494120180606842
1534935252472418308,petrogustavo,La publicación completa de los videos les mostrará por ejemplo que nosotros no sabíamos de pactos con extraditables hasta que la prensa publicó tal infundio y cómo discutimos la defenda ante tal mentira.,09-06-2022,0.0515713207423687,0.02193005196750164,0.02937956340610981,0.03813362866640091,0.06393372267484665,0.23321422934532166,0.02378048747777939,0.3195779025554657,0.2184790074825287
1534935249733419009,petrogustavo,"Como en ninguna parte del mundo, la sociedad colombiana podrá ver todas las reuniones privadas de un movimiento político. 

Que sea. No tenemos ningun temor de ello. Que la gente sepa cuanta mentira se ha arrojado sobre nosotros y sepa quienes y como somos al desnudo.",09-06-2022,0.037587400525808334,0.00032156912493519485,0.004568791948258877,0.35460853576660156,0.0011043261038139462,0.04133785888552666,0.05281088873744011,0.20219872891902924,0.30546194314956665
1534934257830965249,petrogustavo,Entregar drogas regaladas indiscriminadamente es una de las propuestas más locas que he escuchado. La mitigación de daños por consumo de drogas comienza por una amplia política de educación preventiva en los colegios.,09-06-2022,6.019363354425877e-05,0.30320385098457336,0.0370401032269001,0.00022324985184241086,0.0003778928949031979,0.32627931237220764,0.3198905885219574,0.011180281639099121,0.001744466251693666
1534931624642609152,petrogustavo,"Con Harold, hijo de Genoveva y hermano de Kevin, quien fué asesinado.

Quiere ser bailarín profesional, difícil la competencia. ",09-06-2022,0.0074707078747451305,0.011011675000190735,0.06065111979842186,0.014369143173098564,0.019955983385443687,0.5598646998405457,0.20985910296440125,0.05748990550637245,0.05932771414518356
1534903049356988416,petrogustavo,La edición de las grabaciones puede vulnerar los derechos políticos de nuestra militancia. Lo mejor es que cualquier ciudadano o ciudadana pueda acceder a esas horas de grabaciones y sacar sus propias conclusiones.,09-06-2022,0.003883956465870142,0.006896347273141146,0.014613619074225426,0.7050507068634033,0.0015793161001056433,0.02988140843808651,0.009559262543916702,0.16053424775600433,0.06800110638141632
1534903047733882883,petrogustavo,"Sabemos que la revista Semana tiene horas de grabaciones echas a través de la plataforma de comunicaciones de Colombia Humana.

En defensa de los derechos de toda nuestra militancia que participó en decenas de reuniones, les solicito publiquen ya la totalidad de las grabaciones.",09-06-2022,0.006151609122753143,0.003212795127183199,0.012977860867977142,0.8789027333259583,0.005341631826013327,0.038192808628082275,0.018060073256492615,0.02659623697400093,0.010564273223280907
1534884155829669888,petrogustavo,"Ahora podrán comprobar si en mis reuniones privadas digo una sola palabra soez. Podran ver la calidad de las propuestas de miles de nuestros militantes. Podrán ver la orden tajante de no usar dinero en efectivo. Podrán ver mis actitudes, las más intimas en política.",09-06-2022,0.01891828142106533,0.0013992454623803496,0.12857577204704285,0.011155693791806698,0.003681949805468321,0.10843092203140259,0.28216317296028137,0.3456709086894989,0.10000402480363846
1534880649370382339,petrogustavo,"Me comprometo a iniciar una búsqueda a profundidad de la hija adoptiva de mi contrincante, al igual de los decenas de miles de desaparecidos que hoy tiene Colombia.

La desaparición  es la peor violación de Derechos Humanos en el país. ",09-06-2022,0.0013243068242445588,0.9609643220901489,0.00830868724733591,0.0006072396063245833,0.0020831504371017218,0.015070904046297073,0.007716772612184286,0.002402043202891946,0.001522592967376113
1534878672104177664,petrogustavo,"Agradezco tu ponderación. Los consensos hacia las reformas fundamentales que necesita la sociedad para convivir en paz, tendrán    en ti un aporte de profundidad humanista.",09-06-2022,0.0019007897935807705,0.0003179135965183377,0.0015201051719486713,0.9661436676979065,0.000464024196844548,0.0017979898257181048,0.0006714630872011185,0.008004999719560146,0.01917906105518341
1534878225121296387,petrogustavo,"La campaña ha sufrido la entrega de horas de grabaciones de propuestas de activistas, las decsiones del comité de estrategia nunca las publicarán que siempre fueron convocar a todo el Centro de la Esperanza a una consulta común.

Ahora vamos hacia una gran acuerdo Nacional. ",09-06-2022,0.016219615936279297,0.010998954996466637,0.10880804061889648,0.054736457765102386,0.028202660381793976,0.08641914278268814,0.03535379096865654,0.38952547311782837,0.2697358727455139
1534875569787224066,petrogustavo,"Haciendo patacón pisao, despues de orar dialogamos de los problemas de Quibdó, de la violencia que cayó sobre la familia, y terminamos con la manifestación espontanea en el barrio ",09-06-2022,0.0007128650322556496,0.00040789111517369747,0.010490459389984608,0.0034003339242190123,0.0014374300371855497,0.021538719534873962,0.9311176538467407,0.023553987964987755,0.0073406388983130455
1534871664869134337,petrogustavo,Gracias Julian por su apoyo. Usted será una persona muy clave en materia de educación para Colombia. ,09-06-2022,0.009108290076255798,0.0008660996682010591,0.010400572791695595,0.7989435195922852,0.01123182661831379,0.01594698429107666,0.0027306554839015007,0.09366540610790253,0.057106707245111465
1534865151794548739,petrogustavo,"Estas son las otras encuestas que no publican. Viene el desespero de quienes desde el poder no quieren que el poder cambie.

Señor registrador la pido la máxima neutralidad política suya y de su equipo ",09-06-2022,0.0013601093087345362,0.0012492409441620111,0.004982104990631342,0.6549322009086609,0.003690487239509821,0.014895658940076828,0.11481106281280518,0.14150141179561615,0.0625777393579483
1534863709918662658,petrogustavo,"Esta desesperada la revista Semana con el ascenso en nuestras encuestas. Estan publicando simplemente la evidencia que nos grabaron ilegalmente. ¿Quienes? Los mismos que le entregaron grabaciones: El gobierno.

Un Watergate que debe ser investigado por una comisión independiente",09-06-2022,0.0011251810938119888,0.4514303207397461,0.04147092625498772,0.0024191876873373985,0.0073907156474888325,0.16880670189857483,0.3149428069591522,0.004618488252162933,0.007795676123350859
1534862519935946754,petrogustavo,"Hasta tienen mis padres que hablar para aclarar mi nacimiento.

 ¿Publicamos tambien la foto de mi bautizo? ",09-06-2022,0.004117575008422136,0.002403960097581148,0.023415308445692062,0.013243547640740871,0.04851347953081131,0.5337687730789185,0.02112283743917942,0.3062359690666199,0.04717857018113136
1534858503164252167,petrogustavo,"A tu administrador le digo que precisamente se trata de que las generaciones que hemos vivido 100, 200, 500 años de soledad sí tenganos una segunda oportunidad bajo los cielos de la tierra. ",09-06-2022,0.004959446378052235,0.0038038326893001795,0.008848144672811031,0.30508139729499817,0.004220515955239534,0.01563894748687744,0.014350300654768944,0.15686145424842834,0.48623600602149963
1534856773739372545,petrogustavo,"Levantandome, ahora tenemos reunión con las juventudes de Quibdó. Este ha sido mi cuarto de esta noche. Humilde pero acogedor. Ya me estoy tomando mi tintico ",09-06-2022,0.0012179837794974446,0.00023481140669900924,0.002481589326635003,0.8355019688606262,0.000982952886261046,0.0027024811133742332,0.0008330094860866666,0.13818666338920593,0.01785857416689396
1534856003979825153,petrogustavo,Creo que los chuzados eramos nosotros. Como ha sido en todo este siglo. ,09-06-2022,0.007658851332962513,0.005174456164240837,0.03036992996931076,0.012829748913645744,0.019799133762717247,0.17767098546028137,0.15192797780036926,0.5283075571060181,0.06626135110855103
1534855115437494272,petrogustavo,Como aumentaría su bienestar si estendemos la iniversidad en sus regiones para la juventud.,09-06-2022,0.01829705201089382,0.0049552093259990215,0.060309186577796936,0.11755487322807312,0.0126012759283185,0.13731792569160461,0.011018535122275352,0.17767737805843353,0.460268497467041
1534855113428422657,petrogustavo,"No puede quedar ningún militante ya en su casa. Hay que repsrtir mi solicitud de empleo a millones de Colombiano(a)s. hablar en la vereda , en el pequeño municipio andino. Que sus habitantes sepan de los beneficios que les traería si ayudamos a industrializar sus productos ",09-06-2022,0.04813125357031822,0.020695403218269348,0.03575184568762779,0.16802117228507996,0.021404827013611794,0.17235831916332245,0.13952729105949402,0.13178648054599762,0.26232337951660156
1534724738383286273,petrogustavo,"¡Que tal! Hace dos años se debió entregar la primera linea del metro subterráneo. ¿Qué pasó?

 Que Peñalosa suspendió el proyecto. ",09-06-2022,0.0034984976518899202,0.004959305748343468,0.029304392635822296,0.11501330137252808,0.021466165781021118,0.3879178464412689,0.12393337488174438,0.2878725528717041,0.02603459171950817
1534694920283471872,petrogustavo,Con Genoveva Palacios en el barrio Palenque de Quibdó ,09-06-2022,0.0038735712878406048,0.002755268244072795,0.024082817137241364,0.05742206051945686,0.06502427160739899,0.30029353499412537,0.009629863314330578,0.23141542077064514,0.30550312995910645
1534694811386761222,petrogustavo,,09-06-2022,0.0,0.0,0.0,0.0,0.0,0.0,0.0,0.0,0.0
1534690456294014984,petrogustavo,Voy por un barrio pobre de Quibdó a dormir esta noche aquí ,09-06-2022,0.008813153952360153,0.004357312340289354,0.05118772014975548,0.10954795032739639,0.02255706675350666,0.13070696592330933,0.059740420430898666,0.2645362317562103,0.3485531806945801
1534690064134971392,petrogustavo,Que linda mujer boyacense. ,09-06-2022,0.4392338991165161,0.004285695496946573,0.04041774198412895,0.1827901005744934,0.009189198724925518,0.0904698520898819,0.00848989188671112,0.10829878598451614,0.11682481318712234
1534685155901820929,petrogustavo,"Gracias Juan Carlos Lozada por su apoyo. El medio ambiente no es solo transversal, es esencial en mi programa. ",08-06-2022,0.019842706620693207,0.00861356034874916,0.13340185582637787,0.2864398956298828,0.012395806610584259,0.2686310112476349,0.02030181884765625,0.096255362033844,0.15411794185638428
1534670291707772928,petrogustavo,"Gabriel Garcia Márquez fué un costeño que estudio en Zipaquirá, en mi mismo colegio. ",08-06-2022,0.010835972614586353,0.004517671652138233,0.02806740067899227,0.04478513449430466,0.1741361916065216,0.12859651446342468,0.014425257220864296,0.2681315243244171,0.32650431990623474
1534663235101769729,petrogustavo,"Eatoy absolutamente convencido que la línea férrea entre Tumaco y Puerto Carreño desarrollaría media Colombia, toda la altillanura como una de las grandes despensas alimentarias del mundo. ",08-06-2022,0.04597427323460579,0.002323924796655774,0.020776376128196716,0.1774052232503891,0.007028087507933378,0.02696848474442959,0.015329786576330662,0.2578398287296295,0.44635406136512756
1534662038202601477,petrogustavo,"Con el movimiento de personas con discapacidad.

La educación especial, el censo real, las prótesis que dará el estado para mitigar discapacidades. La contratación de miles de personas en discapacidad por el Estado. Los bonos para cuidadoras de personas en total discapacidad. ",08-06-2022,0.03750772401690483,0.010869048535823822,0.1459166556596756,0.18288877606391907,0.01610071212053299,0.2249411642551422,0.014134654775261879,0.19217194616794586,0.175469309091568
1534660854632878081,petrogustavo,"Es hacia una paz total no hacia atrás, hacia mas violencia. De las palabras violentas de un gobernante siempre surgen las muertes reales en una sociedad. ",08-06-2022,0.0003211197326891124,0.02601640298962593,0.009595698677003384,0.0015045059844851494,0.0002167539787478745,0.026164833456277847,0.9321255683898926,0.00171903136651963,0.002336185658350587
1534660299994935299,petrogustavo,Mujeres de Bucaramanga adelante. Es hacia adelante y no hacia atrás. ,08-06-2022,0.002819289918988943,0.0018523144535720348,0.0039023791905492544,0.013834587298333645,0.005702672991901636,0.22669965028762817,0.0032408535480499268,0.025935335084795952,0.7160129547119141
1534574963570757633,petrogustavo,"Bienvenidos generales(r) Parra, Huertas y Pinto, coronel Barrera y sargento Chaĺá, entre otros.

Una fuerza pública profundamente respetuosa de la Constitución, de los derechos y las libertades de toda la ciudadanía. ",08-06-2022,0.009929263964295387,0.0042386665008962154,0.013150769285857677,0.5444705486297607,0.02672128565609455,0.009090878069400787,0.0045351930893957615,0.22705194354057312,0.16081146895885468
1534524623261401096,petrogustavo,Esta es mi solicitud de empleo que le pido a usted. ,08-06-2022,0.008887430652976036,0.0037676554638892412,0.03220527619123459,0.08151557296514511,0.04593854025006294,0.42940330505371094,0.012733968906104565,0.14844489097595215,0.2371033877134323
1534518730989903873,petrogustavo,Hasta en la FM vamos adelante. ,08-06-2022,0.01674315147101879,0.014003538526594639,0.10701070725917816,0.0626368522644043,0.026863768696784973,0.26143231987953186,0.034002237021923065,0.2156672179698944,0.2616402208805084
1534328653651353600,petrogustavo,"Mis propuestas a los mineros de tunel del carbon en Boyacá, Cundinamarca, Santander y Norte de Santander ",08-06-2022,0.016261203214526176,0.009948506020009518,0.03993542119860649,0.09263116866350174,0.11531810462474823,0.25551170110702515,0.040874697268009186,0.27663469314575195,0.15288454294204712
1534311098417131521,petrogustavo,! Qué verguenza! Un presidente que no conozca su país jamás será un buen presidente. ,07-06-2022,0.00020314844732638448,0.7342017889022827,0.07289273291826248,0.0003152613644488156,0.008125068619847298,0.09635566920042038,0.08180022984743118,0.004990076646208763,0.0011160600697621703
1534308466206158850,petrogustavo,"Cuando nuestra capacidad lo permita, el país producirá paneles solares, algunas empresas barranquilleras ya los pueden hacer. 

La UIS que usted queria vender puede en su ingeniería de petroleos empezar a desarrollar las ingenierías de energías limpias.",07-06-2022,0.014398140832781792,0.0034074720460921526,0.028827225789427757,0.023752223700284958,0.006413729395717382,0.02940194308757782,0.010520080104470253,0.6794400811195374,0.20383918285369873
1534308463500722176,petrogustavo,"¡Ay Dios mio! Ud es ingeniero, debería saber que los paneles solares se importan, ya hay muchos en Colombia. Ecopetrol y empresas privadas ya han instalados granjas solares en Colombia y la línea de transmisión existe pero hay que potenciarla a una de las mas poderosas del país ",07-06-2022,0.005376947112381458,0.030723009258508682,0.07502108067274094,0.12875282764434814,0.001561043318361044,0.06174968555569649,0.6049708724021912,0.06897971779108047,0.02286485768854618
1534306942398742534,petrogustavo,"Lampobreza aumentará en Colombia al 39,2% segun la Cepal. Nos dejaron un país anegado por el hambre.

Les recuerdo que en mi gobierno redujimos la pobreza a la tercera parte y mi contrincante la duplicó en su mandato. ",07-06-2022,0.07846160233020782,0.06344540417194366,0.05218503251671791,0.02225988730788231,0.024152925238013268,0.13966040313243866,0.029914267361164093,0.4703449010848999,0.11957554519176483
1534302786627813377,petrogustavo,Les quiero comunicar que un equipo presidencial no trabaja de seis a cinco. Un equipo presidencial trabaja 24 horas al dia.,07-06-2022,0.013519509695470333,0.005444106180220842,0.02850024215877056,0.02464008331298828,0.12842051684856415,0.05414123833179474,0.010147010907530785,0.40314194560050964,0.3320453464984894
1534277428960448513,petrogustavo,"¿Acordamos candidato por el bien del pais que toda persona imputada deja de estar en campaña y no tendrá cargos públicos?

Firmo este acuerdo ya y si usted no lo firma lo hago yo unilateralmente. ",07-06-2022,0.002942523220553994,0.0015425638994202018,0.005097486078739166,0.09190259128808975,0.01970565877854824,0.05101516470313072,0.02622097358107567,0.22034965455532074,0.5812233686447144
1534276445945700354,petrogustavo,"Tengan ustedes la certeza que toda inversión privada con responsabilidad social y ambiental será respaldada y asegurada por mi gobierno.

La libertad es esencial para la democracia. ",07-06-2022,0.02328614518046379,0.00816571619361639,0.09918172657489777,0.25034502148628235,0.005386525299400091,0.17407110333442688,0.013731420040130615,0.1882973164319992,0.23753505945205688
1534275370001760256,petrogustavo,"5. Buscar como base la media pensión a todo camionero y taxista garantizada por el Estado, aumentarla de acuerdo al tiempo de cotización de camioneros y taxistas",07-06-2022,0.009493927471339703,0.006106399931013584,0.028470449149608612,0.019709313288331032,0.019594255834817886,0.041378311812877655,0.00897379033267498,0.4801471531391144,0.3861263394355774
1534274284591390720,petrogustavo,"3. Búsqueda de alternativas ocupacionales a conductores de plataformas.

4. Legalización del mototaxismo y transporte público donde estén ausentes taxis y buses formalizados.",07-06-2022,0.01431998796761036,0.008911903947591782,0.07822033017873764,0.03332017362117767,0.047637760639190674,0.12921714782714844,0.014137842692434788,0.4084174931049347,0.2658173739910126
