id,user,text,date,bueno,malo,grosero,amable,cortés,descortés,agresivo,pasivo,neutral
1560444874742284291,petrogustavo,"Estuvimos hoy en el Amazonas, en el pulmón de la humanidad. Las fuerzas militares y de policía tienen la orden de salvar la selva. Hasta allí nuestro gobierno llevará el agua potable. Se trata de salvar la vida. ",19-08-2022,0.012674767524003983,0.014365332201123238,0.0969594344496727,0.04424605518579483,0.020450400188565254,0.21263901889324188,0.09505117684602737,0.15662884712219238,0.34698495268821716
1560423345673445379,petrogustavo,"En el colegio San Juan Bosco  de Leticia, Amazonas de educacion étnica, hablarenos de la selva de cómo rescatarla, del salto educativo. ",19-08-2022,0.012427776120603085,0.007888397201895714,0.020891308784484863,0.10642501711845398,0.029263099655508995,0.5671847462654114,0.013168517500162125,0.08142417669296265,0.16132692992687225
1560416757663285251,petrogustavo,"En el colegio San Juan Bosco  de Leticia, Amazonas de educacion étnica, hablarenos de la selva de cómo rescatarla, del salto educativo. ",19-08-2022,0.012427776120603085,0.007888397201895714,0.020891308784484863,0.10642501711845398,0.029263099655508995,0.5671847462654114,0.013168517500162125,0.08142417669296265,0.16132692992687225
1560269250886963203,petrogustavo,"William Camargo es uno de los artífices del proyecto metro subterraneo de Bogotá y conocé a fondo el transporte orientado al desarrollo sostenible 

Ahora dirigirá la ANI. Agencia Nacional de Infraestructura ",18-08-2022,0.012924034148454666,0.00580011447891593,0.11544011533260345,0.10203801095485687,0.050386976450681686,0.25896739959716797,0.03479837626218796,0.20392674207687378,0.21571820974349976
1560265207263289344,petrogustavo,Una de las cartas más bellas que he recibido. ,18-08-2022,0.6696645617485046,0.0003262645041104406,0.001470640185289085,0.30887261033058167,0.0009030004730448127,0.00221050507389009,0.00029006507247686386,0.006087039597332478,0.010175284929573536
1560257085341835264,petrogustavo,"Anoche en el Consejo de Seguridad del Meta, plantee la construcción de una fuerte alianza Estado/ campesinado, ejército/campesinos que es un verdadero blindaje contra la violencia.

Revivir el plan de sustitucion  y una nueva relación entre la familia campesina y la selva ",18-08-2022,0.02534300833940506,0.010035978630185127,0.07763874530792236,0.1057330071926117,0.011849765665829182,0.13575100898742676,0.10825826227664948,0.19091400504112244,0.33447620272636414
1560062315671724034,petrogustavo,"Personas adultas que están aprendiendo a leer y escribir, me entregaron esta gran carta hoy en Villavicencio. Les felicito e invitó a la ciudadanía a abrazar siempre el conocimiento y el deseo de superación.

Agradezco este esfuerzo del gobierno del alcalde Harman. ",18-08-2022,0.01626843772828579,0.0009736554347909987,0.00432204594835639,0.8941558003425598,0.0028078421019017696,0.005983340088278055,0.0014833192108199,0.04641455039381981,0.027590978890657425
1560055261695459328,petrogustavo,En el consejo de seguridad integral del departamento del Meta. ,18-08-2022,0.002172674285247922,0.0014551288913935423,0.021765394136309624,0.011033164337277412,0.004954119678586721,0.767554521560669,0.004580969922244549,0.04296280816197395,0.1435212939977646
1560005619406540805,petrogustavo,"Comparto almuetzo con la tropa en Apiay. Las opciones para los jovenes una vez se retiran del ejército, la armada o la fuerza aérea. ",17-08-2022,0.006912581156939268,0.0025170950684696436,0.022581087425351143,0.19468924403190613,0.017908582463860512,0.07601792365312576,0.5291637182235718,0.08859560638666153,0.06161416694521904
1559885142491074562,petrogustavo,"Ha muerto mi amigo. Rafael Vergara. Fue de la Dirección Nacional del M19 y se convirtio en in lider excelso del ambientalismo cartagenero.

Viste el triunfo popular hermano. Mi alma llora.

QEPD ",17-08-2022,0.07863769680261612,0.012429035268723965,0.06980381160974503,0.03711068257689476,0.17729702591896057,0.15456034243106842,0.08893198519945145,0.18664084374904633,0.19458860158920288
1559358477620977664,petrogustavo,Primera semana en la presidencia de Colombia #ComienzaTuGobierno ,16-08-2022,0.003672885475680232,0.001834800117649138,0.019893797114491463,0.026891998946666718,0.0054639424197375774,0.2502986192703247,0.011976683512330055,0.27505120635032654,0.40491604804992676
1559190662653919232,petrogustavo,"Objetivo de Colombia: La Paz.

",15-08-2022,0.003438935149461031,0.0037948705721646547,0.054984621703624725,0.07314091920852661,0.005766650661826134,0.17950746417045593,0.007880747318267822,0.2053624838590622,0.4661232829093933
1558856430635163650,petrogustavo,"Aquí encontrarán un importante estudio de economía y crisis climática en América Latina.

La posibilidad de un gran Plan Verde para latinoamerica que mi gobierno está dispuesto a respaldar 
 ",14-08-2022,0.07444353401660919,0.0053256722167134285,0.044300660490989685,0.2552546262741089,0.00918033067137003,0.0871957316994667,0.008976396173238754,0.13913916051387787,0.3761838674545288
1558829728139706368,petrogustavo,"El sucreño, de Flor del Monte, Arturo Luna, biólogo con énfasis en biotecnología, microbiología, inmunología, y bioquímica será Ministro de Ciencias. Arturo Luna lideró agenda en uso sostenible para
la transición hacia una economía baja en carbono y basada en capital natural",14-08-2022,0.005194928962737322,0.002081991406157613,0.017996959388256073,0.020079312846064568,0.004250899888575077,0.02202732488512993,0.005959364119917154,0.7811911702156067,0.14121803641319275
1558518054975315969,petrogustavo,"La comisión de masacres y su impunidad en jusrisdicciones de mandos militares y policiales afectará la hoja de vida de los mandos

Desde ahora todo mando militar o policial en su jurisdicción debe velar por neutralizar al máximo la comisión de masacre y muerte de lideres sociales",13-08-2022,0.0016029365360736847,0.025631237775087357,0.011198054999113083,0.0023714927956461906,0.004904310218989849,0.017757203429937363,0.8575336933135986,0.05585620924830437,0.023144930601119995
1558513133085491205,petrogustavo,"Esta foto de Esteban Vega muestra simbólicamente, lo que significa abrir los espacios públicos a la población. ",13-08-2022,0.002939817262813449,0.0006610355922020972,0.011965621262788773,0.017648423090577126,0.003367122495546937,0.13422982394695282,0.0014212633250281215,0.46922940015792847,0.3585374355316162
1558295443641098245,petrogustavo,Comparto la política industrial del gobierno con la ANDI ,13-08-2022,0.021135220304131508,0.013379237614572048,0.056029219180345535,0.047997914254665375,0.05401027947664261,0.16773582994937897,0.019505435600876808,0.2969251275062561,0.32328173518180847
1558208019460128768,petrogustavo,"Nuestra nueva cúpula de la fuerza pública. Pasar a la estrategia de la seguridad humana donde cuidar la vida, los derechos y las libertades de las gentes sea lo fundamental. ",12-08-2022,0.01366591826081276,0.011475272476673126,0.0887007862329483,0.1099667102098465,0.010836555622518063,0.12896595895290375,0.2295643389225006,0.06084664165973663,0.3459778428077698
1558089834161352705,petrogustavo,Terminé mi jornada en el Chocó visitando el bario Palenque y la casa de Genoveva quien me acogio una dia que dormí alli en campaña. Un hijo joven de Genoveva murió asesinado. Mi objetivo es construir la estrategia eficaz que permita disminuir la pobreza y la violencia en Chocó ,12-08-2022,0.004633655305951834,0.015137927606701851,0.020943310111761093,0.012170352041721344,0.012348614633083344,0.04407503828406334,0.7306962609291077,0.07448584586381912,0.08550897985696793
1558072202800545793,petrogustavo,"La estrategia antidrogas utilizada hasta ahora, ha fortalecido en vez de debilitar, las fuerzas de las mafias.

La fiscalía colombiana aquí logró mostrar eficacia investigativa. Felicitaciones",12-08-2022,0.6591755747795105,0.000321380328387022,0.0016631255857646465,0.31223294138908386,0.0003244144900236279,0.002662615617737174,0.0007732591475360096,0.012198436073958874,0.01064822357147932
1558072200984657920,petrogustavo,La investigación sobre el asesinato del fiscal paraguayo Marcelo Pecci cometido por el narcotraficante uruguayo Marset en territorio colombiano demuestra que hace mucho el narco dejo de ser un problema bilateral colombo estadounidense y es hoy un problema americano y mundial. ,12-08-2022,0.9142780303955078,0.004187455400824547,0.004649013746529818,0.0012615328887477517,0.005472483579069376,0.013168496079742908,0.01358585711568594,0.015790415927767754,0.0276066605001688
1557899748803223552,petrogustavo,"Abierta al público y a su libre tránsito la plazoleta Nuñez y el parque entre la carrera séptima y octava. 

Este paseo peatonal será un hermoso recorrido para distensionarse. El espacio público siempre es un espacio democrático y aumenta la calidad de vida. ",12-08-2022,0.05146918445825577,0.0005826434935443103,0.01703273318707943,0.6269118189811707,0.005015918985009193,0.008428873494267464,0.0020020136144012213,0.06255808472633362,0.22599875926971436
1557731013647749122,petrogustavo,"Mi hija Antonella me pidio retransmitirles esta canción, me pareció muy buena

",11-08-2022,0.6048043966293335,0.0006957455771043897,0.0024339554365724325,0.24252274632453918,0.005832906346768141,0.03150287643074989,0.0013269385090097785,0.08906163275241852,0.02181876264512539
1557514476492132354,petrogustavo,"Jorge Eduardo Londoño, exgobernador, exsenador y exministro será el director nacional del SENA. El SENA preparará y ayudará al campesinado colombiano en la soberanía alimentaria y será el gran instrumento de la Ciencia y la Tecnología en la economía productiva.",10-08-2022,0.011879237368702888,0.008133351802825928,0.08296012878417969,0.05563253164291382,0.015266591683030128,0.09623973816633224,0.02995912916958332,0.3557261526584625,0.34420305490493774
1557462027106488320,petrogustavo,"Para todo ciudadano o ciudadana con título de doctor en Colombia o en el extranjero que quiera colaborar con la conducción del gobierno, abrimos este link para que se pueda inscribir.

",10-08-2022,0.014593771658837795,0.00737788388505578,0.04124665632843971,0.05854083597660065,0.021554090082645416,0.3804248571395874,0.015675637871026993,0.19645406305789948,0.2641322612762451
1557346090256572416,petrogustavo,He dado la orden en Consejo de ministros de desmantelar todas las nóminas paralelas que existan en las entidades públicas y de eliminar todo gasto suntuario o superfluo.,10-08-2022,0.004614370409399271,0.0034107272513210773,0.03845590725541115,0.019589338451623917,0.005044220946729183,0.07795833051204681,0.0249306783080101,0.670299768447876,0.15569666028022766
1557344431556149249,petrogustavo,"Compartí personalmente con Jeffrey Sachs, uno de los mejores economistas del mundo, la urgencia de pasar a economías descarbonizadas y con ellas cumplir las metas del milenio, ODS, cuyos indicadores ayudó a construir.

",10-08-2022,0.030409453436732292,0.010189216583967209,0.027800118550658226,0.17203615605831146,0.0729057714343071,0.037723492830991745,0.024215808138251305,0.24963752925395966,0.37508243322372437
1557138776354332672,petrogustavo,"Cesar Ferrari será el director de planeacion nacional, DNP, ingeniero civil de la Universidad Católica del Perú, Master en planificación regional y urbana de la New York University, y Doctor en Economía de Boston University, actual profesor de Economia de la Javeriana",09-08-2022,0.00988733395934105,0.005944674834609032,0.032206930220127106,0.03165530040860176,0.021585140377283096,0.3862627148628235,0.020751969888806343,0.20789018273353577,0.28381577134132385
1556995114345664512,petrogustavo,"Para quienes gusten de estadísticas, la Reforma tributaria que presentamos disminuirá el indice Gini, el indicador de la desigualdad, de 0.54 a 0.49.",09-08-2022,0.027425110340118408,0.003065579105168581,0.02836650237441063,0.05716872215270996,0.005513842683285475,0.3649734854698181,0.006960204336792231,0.1838936060667038,0.32263293862342834
1556995111879311360,petrogustavo,"La reforma tributaria es un paso importante para lograr un gran Pacto Social, avanzar hacia la paz, y avanzar hacia la Justicia.

Buen trabajo de José Antonio Ocampo y Luis Carlos Reyes.",09-08-2022,0.7786872386932373,0.0026897634379565716,0.016779782250523567,0.09498835355043411,0.003168675350025296,0.0035901409573853016,0.0022469840478152037,0.021394474431872368,0.07645447552204132
1556995098499506178,petrogustavo,"La reforma tributaria que hemos presentado cumple con lo que dijimos en nuestra campaña. Grava a los que más tienen y gasta en la educación para todos y en acabar el hambre en la niñez pobre.

Logra disminuir de manera inportante la desigualdad social. ",09-08-2022,0.7915681600570679,0.0003309713501948863,0.002250412944704294,0.15920592844486237,0.000549604301340878,0.0007147413562051952,0.0004609260940924287,0.017419176176190376,0.02750006876885891
1556816293680107521,petrogustavo,"Agradezco la disposición del presidente de Chile @gabrielboric para ayudarnos a construir un acuerdo de Paz con el ELN. 

También aprovechamos el encuentro para invitarlo a fortalecer los procesos de integración latinoamericana en pro del desarrollo de nuestras naciones. ",09-08-2022,0.0008494791691191494,0.00012919736036565155,0.00038256371044553816,0.9848260283470154,0.00041903441888280213,0.0005949779879301786,0.00034497029264457524,0.005258486606180668,0.0071952370926737785
1556414615357120512,petrogustavo,"Germán Umaña Mendoza, economista de la Universidad Nacional, y especialista en planificación e industria será el Ministro de Comercio e Industria. Nuestra economía debe volcarse al turismo, a potenciar y a revitalizar la producción y la industria.",07-08-2022,0.014353974722325802,0.006924834102392197,0.046249136328697205,0.07286783307790756,0.011008010245859623,0.06274165958166122,0.02130974270403385,0.1917051374912262,0.5728396773338318
1556413125812961281,petrogustavo,"El abogado Guillermo Reyes será el nuevo Ministro de Transporte. Estará al frente de la política para integrar todos los territorios del país y de revitalizar el transporte férreo y fluvial para tener un sistema de transporte moderno, eficiente y democrático.",07-08-2022,0.007977757602930069,0.006156741175800562,0.0568104162812233,0.05545360594987869,0.013555728830397129,0.06979204714298248,0.0248985905200243,0.20741835236549377,0.5579367280006409
1556413075036700672,petrogustavo,Mery Gutiérrez será la Ministra TIC. Es especialista en nuevas tecnologías de la información. Tendrá la tarea de llevar la infraestructura tecnológica a donde no ha llegado antes. Trabajaremos para que todos los niños y jóvenes gocen del derecho al acceso a internet.,07-08-2022,0.01565491035580635,0.009341948665678501,0.12114863097667694,0.09026982635259628,0.02431817166507244,0.10006025433540344,0.027193425223231316,0.12921594083309174,0.48279687762260437
1556412318279503873,petrogustavo,"Una sociedad del conocimiento no es una utopía, llegó el momento de devolverle la deuda a la educación.

#ComienzaTuGobierno ",07-08-2022,0.014866523444652557,0.022398360073566437,0.06418753415346146,0.028315456584095955,0.008561442606151104,0.3105481266975403,0.10355161130428314,0.28963080048561096,0.15794023871421814
1556382831009464321,petrogustavo,Juro a Dios y al pueblo de Colombia cumplir firmemente la Constitución y las leyes de Colombia. ,07-08-2022,0.010191481560468674,0.004783586598932743,0.010851153172552586,0.3051025867462158,0.009374069981276989,0.01225472241640091,0.004122492857277393,0.11500610411167145,0.5283137559890747
1556376187185799169,petrogustavo,"Escuchamos el himno de una nueva Colombia. 

Una potencia de la vida #ComienzaTuGobierno. ",07-08-2022,0.014899823814630508,0.008392741903662682,0.0353226438164711,0.14587193727493286,0.012628398835659027,0.4007911682128906,0.03390371799468994,0.19931629300117493,0.14887328445911407
1556373630182907905,petrogustavo,"Invitadas e invitados a conectarse a la transmisión en vivo de la posesión presidencial. #ComienzaTuGobierno

Facebook 👉 

YouTube 👉 

Twitter 👉 

Web 👉  ",07-08-2022,0.005535291973501444,0.002696537645533681,0.048694219440221786,0.060484591871500015,0.0055426605977118015,0.6817594170570374,0.008484412916004658,0.04459063336253166,0.14221219718456268
1556340625708040193,petrogustavo,"Los y las invito a seguir la señal en vivo de la posesión presidencial.

Comparte con tus amigos y amigas. 

",07-08-2022,0.01077955961227417,0.0022730669006705284,0.009158806875348091,0.8507747650146484,0.006493678316473961,0.02652786299586296,0.004840846639126539,0.017095692455768585,0.07205568253993988
1556291738603606018,petrogustavo,"La Ministra de Vivienda será Catalina Velasco Campuzano, mujer experta en hábitat y planeación. Una de sus responsabilidades será la de liderar una verdadera política pública de vivienda social en Colombia.",07-08-2022,0.015177353285253048,0.011710760183632374,0.08648510277271271,0.09914624691009521,0.023953992873430252,0.2642921805381775,0.023985011503100395,0.16130010783672333,0.31394919753074646
1556291683544977408,petrogustavo,"Néstor Osuna, abogado del Externado y quien fue magistrado del Consejo Superior de la Judicatura será el Ministro de Justicia. La independencia judicial, la lucha contra la corrupción y el acceso de la ciudadanía al sistema judicial serán pilares de una reforma a la justicia.",07-08-2022,0.007911179214715958,0.008593621663749218,0.05107181519269943,0.03963995724916458,0.27244022488594055,0.04461789131164551,0.019514871761202812,0.26288723945617676,0.29332318902015686
1556268449801846786,petrogustavo,,07-08-2022,0.0,0.0,0.0,0.0,0.0,0.0,0.0,0.0,0.0
1556142441274769412,petrogustavo,"Los espero 7 de agosto centro de Bogotá, entrada por la 7 y la 8 de la avenida 19. ",07-08-2022,0.0046678646467626095,0.00333444238640368,0.03994634002447128,0.016612635925412178,0.07864565402269363,0.4036385118961334,0.013232143595814705,0.2621501684188843,0.17777226865291595
1555980311854551042,petrogustavo,"Alfonso Prada será el Ministro del Interior. Ha sido Concejal y Representante a la Cámara. Será responsable de las relaciones con el legislativo y de trazar políticas en materia de derechos humanos, participación ciudadana y ordenamiento territorial.",06-08-2022,0.017640478909015656,0.012638266198337078,0.10082363337278366,0.07684551179409027,0.08822979778051376,0.10447163879871368,0.03374191373586655,0.19749878346920013,0.3681100010871887
1555980237523095552,petrogustavo,La reconocida deportista María Isabel Urrutia será nuestra Ministra del Deporte. Promovió la profesionalización de los deportistas durante su paso en el Congreso y será una representante del pueblo afrocolombiano en el gabinete.,06-08-2022,0.035643670707941055,0.013374095782637596,0.08616691827774048,0.17680223286151886,0.031259652227163315,0.07852906733751297,0.028070664033293724,0.3343920111656189,0.2157616764307022
1555980126923489280,petrogustavo,"En el Ministerio del Trabajo estará Gloria Inés Ramírez, una defensora de los derechos humanos y la reivindicación de los trabajadores. Ha sido una mujer que ha luchado por los derechos de las mujeres y la equidad de género.",06-08-2022,0.029274936765432358,0.01706559583544731,0.09304503351449966,0.16982783377170563,0.07529016584157944,0.04831264540553093,0.02379249967634678,0.08214669674634933,0.4612445831298828
1555978158834319360,petrogustavo,He designado a Irene Vélez como Ministra de Minas y Energía. Filósofa de la Unal con doctorado en Geografía Política de Cophenague. Es una mujer con amplia experiencia en el sector ambiental y que tendrá la ardua tarea de liderar la transición hacia una economía no extractivista.,06-08-2022,0.010200339369475842,0.006294343154877424,0.04655134677886963,0.04762953519821167,0.030011720955371857,0.061119064688682556,0.016120795160531998,0.4840122163295746,0.29806071519851685
1555912683387584512,petrogustavo,Mañana las y los espero en el centro de Bogotá. Que el 7 de agosto sea una gran fiesta popular. ,06-08-2022,0.045942522585392,0.00381278432905674,0.0850175991654396,0.2968677580356598,0.014405705034732819,0.07385450601577759,0.06585864722728729,0.16207553446292877,0.25216495990753174
1555701287802621952,petrogustavo,Recibo las propuestas para proteger a los líderes sociales de parte de las organizaciones de DDHH ,05-08-2022,0.019986772909760475,0.006092255003750324,0.041842881590127945,0.19473132491111755,0.012889670208096504,0.03769373893737793,0.010000512935221195,0.2710259258747101,0.4057369530200958
1555571074460532742,petrogustavo,En el corazón del mundo. ,05-08-2022,0.008399232290685177,0.009154724888503551,0.05449972674250603,0.06794904917478561,0.010944579727947712,0.4494493007659912,0.014247039332985878,0.1285962164402008,0.2567601203918457
1555319712229326849,petrogustavo,En la posesión ancestral del presidente en el corazón del mundo. Ceremonia arhuaca. ,04-08-2022,0.011600710451602936,0.007078445050865412,0.0796365886926651,0.12144970148801804,0.02198900282382965,0.14912989735603333,0.03201231732964516,0.34204259514808655,0.2350607067346573
1555181988004470784,petrogustavo,"Ahora, a la Sierra Nevada de Santa Marta. ",04-08-2022,0.005183756351470947,0.003163108369335532,0.03812574967741966,0.038812730461359024,0.010165609419345856,0.44325920939445496,0.024379370734095573,0.2299233227968216,0.20698712766170502
1555177873841049604,petrogustavo,"Preparando la imagen oficial en la Serranía de la Macarena. La inmensidad de la biodiversidad y sus climas. La magia de Colombia, potencia mundial de la vida.",04-08-2022,0.020480666309595108,0.007326872553676367,0.05888596177101135,0.1674143671989441,0.014494338072836399,0.19675695896148682,0.015849364921450615,0.19460885226726532,0.3241825997829437
1553919807908724737,petrogustavo,,01-08-2022,0.0,0.0,0.0,0.0,0.0,0.0,0.0,0.0,0.0
1553734908350238724,petrogustavo,"Si el Estado comete atrocidades deja de ser legítimo.

Lo que creo el constituyente del 91, fundamento de toda legitimidad, fué un Estado Social de Derecho, no un Estado Atroz.",31-07-2022,0.0020039151422679424,0.17164461314678192,0.02065923810005188,0.0041290451772511005,0.0014026708668097854,0.05659116804599762,0.685225784778595,0.016691459342837334,0.041652023792266846
1553559952198963200,petrogustavo,Muy bien jugadoras. Felicitaciones al fútbol femenino de Colombia.,31-07-2022,0.663962185382843,0.0014595134416595101,0.008407671935856342,0.21120929718017578,0.0028821818996220827,0.00873348955065012,0.004120611120015383,0.053389426320791245,0.04583558440208435
1553439285461876736,petrogustavo,"La cumbre indígena por el Cambio. Silvia, Cauca. ",30-07-2022,0.005644350312650204,0.003999464679509401,0.04819381609559059,0.07933628559112549,0.013046016916632652,0.2468303143978119,0.019759075716137886,0.4175679385662079,0.16562269628047943
1553433343450120192,petrogustavo,"Le solicitamos a la Justicia Especial para la Paz, JEP, maximizar la verdad en el país. ",30-07-2022,0.009015414863824844,0.023568030446767807,0.037251465022563934,0.17251047492027283,0.019660919904708862,0.32101455330848694,0.019955288618803024,0.10049672424793243,0.2965271472930908
1553383967138758659,petrogustavo,"Cuando recibí el informe de la Comisión de la Verdad afirmé que lo conocería toda la sociedad colombiana.

La verdad es la base de la Paz.",30-07-2022,0.006688534747809172,0.0031936406157910824,0.018590396270155907,0.5546308755874634,0.0035410139244049788,0.03376907855272293,0.004144201520830393,0.07498122751712799,0.300461083650589
1552837215549538305,petrogustavo,Hoy se presentó el informe final del empalme con el gobierno actual ,29-07-2022,0.0009989181999117136,0.0007258886471390724,0.006967685651034117,0.0017790388083085418,0.004325189162045717,0.08859238773584366,0.8818867206573486,0.007174525409936905,0.007549596019089222
1551915645322907648,petrogustavo,Una de las primeras tareas del ministerio del deporte es lograr que se constituya la liga de fútbol femenino.,26-07-2022,0.008280863985419273,0.005108550190925598,0.06547447293996811,0.03922628238797188,0.010723561979830265,0.41402962803840637,0.0318731963634491,0.14524756371974945,0.2800358533859253
1551904473840246784,petrogustavo,"¡FELICITACIONES!
De verdad, verdad.
Poder a la mujer. ",26-07-2022,0.07355527579784393,0.001221229089424014,0.008921390399336815,0.8295690417289734,0.0009247473790310323,0.014502869918942451,0.002185228280723095,0.012999610975384712,0.05612055957317352
1551900749063487489,petrogustavo,"Excelente. La via del dialogo regional vinculante debe ser un cambio seguro hacia la convivencia y hacia la justicia social.

Recibo con gratitud este mensaje de la ACIN en el norte del Cauca. ",26-07-2022,0.5187614560127258,0.00036094177630729973,0.00016410541138611734,0.47511813044548035,0.0005911916960030794,0.00041454166057519615,0.000238442124100402,0.0010616523213684559,0.003289434127509594
1551660617001484288,petrogustavo,"Danilo Rueda, actual director de la Comisión Intereclesial de Justicia y Paz, será nuestro comisionado para la Paz.

Una potencia mundial para la Vida significa construir la paz. ",25-07-2022,0.007923595607280731,0.003893765853717923,0.057465650141239166,0.3149738311767578,0.010684304870665073,0.29634949564933777,0.008795035071671009,0.10238444060087204,0.1975298672914505
1551642756283453440,petrogustavo,"Este contrato de medicamentos amarrado por tres años en la policía nacional debe ser investigado a fondo. Si es un contrato leonino, sus autores deberán ser procesados.

",25-07-2022,0.0025426531210541725,0.4020610451698303,0.05443132296204567,0.00491188233718276,0.0080171013250947,0.294762521982193,0.20569799840450287,0.0193807203322649,0.008194693364202976
