id,user,text,date,bueno,malo,grosero,amable,cortés,descortés,agresivo,pasivo,neutral
1526189421850247169,petrogustavo,"Le agradezco al liderazgo de ""Gente en Movimiento"" de Caldas, a Oscar y Mauricio Lizcano, al representante Wilder Escobar  su apoyo. Bienvenidos a la campaña del Cambio por la Vida. ",16-05-2022,0.002631519688293338,0.0003053571272175759,0.0012315111234784126,0.9801443815231323,0.0011463607661426067,0.003349059261381626,0.0005041158874519169,0.003561569843441248,0.007126110605895519
1526044146003329025,petrogustavo,"A partir de mañana todas las fuerzas, las personas que nos apoyan, a la calle, al barrio. y la vereda, a pintar murales a hacer afiches, a convencer al público de la necesidad del cambio. ya nadie debe quedarse en la casa. Esta es la movilización popular hacia el 29M",16-05-2022,0.028428375720977783,0.020310547202825546,0.03243397921323776,0.17706139385700226,0.026600273326039314,0.08633840829133987,0.2045757919549942,0.11793117970228195,0.30632004141807556
1526040870709084160,petrogustavo,Gracias Elkin por su apoyo. Vamos con toda por el Cambio por la Vida. ,16-05-2022,0.010925866663455963,0.0023011253215372562,0.0354105681180954,0.609036386013031,0.02156417816877365,0.06461098790168762,0.006817729212343693,0.10111359506845474,0.14821960031986237
1526002108033540097,petrogustavo,"El que venda su voto elige un ladrón o una asesino al poder. Terminará robando y asesinando su propia existencia y la de su familia.

Lorica, Córdoba. ",16-05-2022,0.00018004467710852623,0.19080430269241333,0.002772607607766986,0.0005417711799964309,0.006106236018240452,0.011960668489336967,0.7779592871665955,0.007564215455204248,0.0021109236404299736
1525998152993611776,petrogustavo,Gracias Ernesto Benjumea por tu apoyo. El cambio debe ser una explosión de Arte y de Cultura. ,16-05-2022,0.013498444110155106,0.005365660414099693,0.03141947090625763,0.6930252909660339,0.014548907987773418,0.06111634150147438,0.012190299108624458,0.057368602603673935,0.11146699637174606
1525961850080436232,petrogustavo,Lorica. ,15-05-2022,0.006599750369787216,0.03389427065849304,0.10078021883964539,0.07203572988510132,0.010452338494360447,0.23289506137371063,0.07335932552814484,0.26891231536865234,0.20107094943523407
1525961840358051843,petrogustavo,Lorica ahora. ,15-05-2022,0.0010227796155959368,0.0008274319116026163,0.018461519852280617,0.021966177970170975,0.009227338247001171,0.07418505102396011,0.8354398012161255,0.013552320189774036,0.025317536666989326
1525918799026872326,petrogustavo,,15-05-2022,0.0,0.0,0.0,0.0,0.0,0.0,0.0,0.0,0.0
1525918597012406272,petrogustavo,"Estamos en el Financial Times.

",15-05-2022,0.00740944966673851,0.004202669020742178,0.03716101869940758,0.03349943086504936,0.021471407264471054,0.2510579526424408,0.026509176939725876,0.36287811398506165,0.25581082701683044
1525904441274257409,petrogustavo,Esta fue la inmensa manifestación de Soacha. ,15-05-2022,0.0012020880822092295,0.00039089302299544215,0.011669211089611053,0.003004248021170497,0.001417877501808107,0.05676201358437538,0.9169919490814209,0.003527035005390644,0.0050345528870821
1525902265797705729,petrogustavo,,15-05-2022,0.0,0.0,0.0,0.0,0.0,0.0,0.0,0.0,0.0
1525901978743758851,petrogustavo,"Soacha no será el patio trasero de Bogotá, sino la puerta de entrada de la Sabana.

Aqui se construiran.las sedes universitarias públicas con servicios educativos gratuitos, aqui comenzará la transformación de la movilidad en eléctrica, aquí se instalará el internet como derecho. ",15-05-2022,0.00490997452288866,0.0020589428022503853,0.0077103241346776485,0.016005851328372955,0.005391440819948912,0.08015315979719162,0.0065408749505877495,0.2888929545879364,0.5883364677429199
1525887629291622402,petrogustavo,"Soacha, lleno total. ",15-05-2022,0.23244048655033112,0.0031600764486938715,0.05150706693530083,0.04680982977151871,0.0030038992408663034,0.07292848825454712,0.5382092595100403,0.013333830051124096,0.03860710188746452
1525883881253228544,petrogustavo,"El gota a gota y el uribismo. El veneno contra la economía popular que implica pagar 20% diario de interés.

Por eso Pereira no progresa. Nosotros le entregaremos a la economía popular créditos baratos para impulsar la producción. ",15-05-2022,0.0008614043472334743,0.3802386224269867,0.028266489505767822,0.001165900961495936,0.0006306797731667757,0.06115558370947838,0.5079777240753174,0.0171747338026762,0.0025287631433457136
1525882622739726336,petrogustavo,Nosotros buscando proteger a los productores de leche de las importaciones y Colanta apoyando a quienes van a importar la leche. ,15-05-2022,0.005706453695893288,0.002621657680720091,0.025840336456894875,0.049303896725177765,0.006102540995925665,0.11891396343708038,0.01162756234407425,0.4503984749317169,0.32948508858680725
1525882300881375232,petrogustavo,Cosas que pasan. Vestidos de Gutierrez que gritan Petro. ,15-05-2022,0.0012706551933661103,0.0009289794252254069,0.010687955655157566,0.0028723047580569983,0.001640011672861874,0.08116815239191055,0.8726972937583923,0.019672343507409096,0.009062285535037518
1525880235387920384,petrogustavo,Soacha. ,15-05-2022,0.00613495334982872,0.01759512536227703,0.0391811765730381,0.1079275980591774,0.011844552122056484,0.2610119581222534,0.048845816403627396,0.2997561991214752,0.20770269632339478
1525850685044146179,petrogustavo,,15-05-2022,0.0,0.0,0.0,0.0,0.0,0.0,0.0,0.0,0.0
1525829387706322944,petrogustavo,"La articulación de la política con el crimen ha sido una constante del movimiento político que nos controvierte.

Aquí ve usted cómo el dueño del ""gota gota"" se junta con el que quiere ser presidente. ¿Cree usted que Colombia será mejor si este tipo de personas la dirigen? ",15-05-2022,0.010995330289006233,0.00950264185667038,0.02377987839281559,0.011618386954069138,0.029026227071881294,0.1475958377122879,0.31296929717063904,0.4186932146549225,0.03581918776035309
1525698682192023552,petrogustavo,Lo que aquí pasa es un delito. Se trata de algunos empresarios constriñiendo el voto de sus trabajadores. Hay que recopilar toda la información de esta juntura de la política con el crimen. ,15-05-2022,5.408705328591168e-05,0.546392023563385,0.0028420239686965942,0.00019293180957902223,0.00033466803142800927,0.027142494916915894,0.4225775897502899,0.0002556469407863915,0.00020856427727267146
1525659940953722881,petrogustavo,"Cartagena con el cambio, la ciudad de la independencia grita Libertad. ",15-05-2022,0.009840864688158035,0.0037252178881317377,0.04516664519906044,0.16216948628425598,0.08087822794914246,0.27189144492149353,0.06822134554386139,0.14494241774082184,0.2131643444299698
1525629837125246977,petrogustavo,Cartagena ,15-05-2022,0.007292685564607382,0.009982453659176826,0.03734758496284485,0.04259024187922478,0.0341089703142643,0.2566817104816437,0.021670440211892128,0.3138393759727478,0.27648651599884033
1525565760386613249,petrogustavo,"No entiendo porque quieren que el agua de Bucaramanga se use y se ensucie para sacar el oro de Danturbán.

El cambio debe garantizar que el agua sea para la gente y no para el oro. Ese es nuestro compromiso de vida. ",14-05-2022,0.0007322055171243846,0.23877066373825073,0.046852510422468185,0.001661645364947617,0.009608320891857147,0.34086573123931885,0.2730622887611389,0.06659581512212753,0.0218508318066597
1525563476424409089,petrogustavo,"Así fue Fusagasugá. El rio sumapaz será para la agricultura y el consumo humano.

Reverdecer el campo con el café que se industrialice. Hacer de Fusa un cerebro de la universidad pública de Colombia. ",14-05-2022,0.05733702331781387,0.0061645302921533585,0.04773310571908951,0.10514497011899948,0.04381171241402626,0.09070085734128952,0.020653201267123222,0.34974291920661926,0.2787117063999176
1525553969350774790,petrogustavo,,14-05-2022,0.0,0.0,0.0,0.0,0.0,0.0,0.0,0.0,0.0
1525524823564292101,petrogustavo,"Corozal, Sucre. ",14-05-2022,0.008017410524189472,0.022280586883425713,0.056657981127500534,0.06555107980966568,0.09043604135513306,0.19802281260490417,0.017854243516921997,0.3098725974559784,0.231307253241539
1525522445821673472,petrogustavo,"A pesar del temor, con la esperanza, este es el pueblo de Corozal acompañando, sin dejarse comprar, el cambio. ",14-05-2022,0.005278429482132196,0.00032845305395312607,0.001277109724469483,0.27373650670051575,0.0018877906259149313,0.003306074533611536,0.0006939666345715523,0.6783372759819031,0.03515443205833435
1525505127842566144,petrogustavo,"Ahora en Corozal, Sucre ",14-05-2022,0.003819237696006894,0.0035005034878849983,0.06422961503267288,0.03820926696062088,0.021705159917473793,0.482768714427948,0.02324088104069233,0.16366414725780487,0.19886253774166107
1525478515499573248,petrogustavo,Túmbalos. ,14-05-2022,0.0054125539027154446,0.027667613700032234,0.07042557001113892,0.03340522572398186,0.010529452934861183,0.2668602764606476,0.08633693307638168,0.2851525545120239,0.21420980989933014
1525475422179315712,petrogustavo,Este es mi compromiso. ,14-05-2022,0.011756662279367447,0.010581430979073048,0.09743785113096237,0.06402401626110077,0.047447338700294495,0.4166306257247925,0.02024109847843647,0.11229363083839417,0.21958735585212708
1525470592048189446,petrogustavo,,14-05-2022,0.0,0.0,0.0,0.0,0.0,0.0,0.0,0.0,0.0
1525468139818991618,petrogustavo,,14-05-2022,0.0,0.0,0.0,0.0,0.0,0.0,0.0,0.0,0.0
1525296790244925440,petrogustavo,"El liberalismo amazónico se une a la Campaña del cambio por la Vida.

Florencia, Caquetá. ",14-05-2022,0.0049969409592449665,0.002412528032436967,0.029596887528896332,0.04726211354136467,0.008084543980658054,0.6836317777633667,0.010023161768913269,0.11436231434345245,0.09962965548038483
1525182424602144768,petrogustavo,"Bienvenida senadora Andrea Padilla a la campaña de Cambio por la Vida.

El respeto a los animales y a la naturaleza es esencial para ser potencia mundial de la Vida. ",13-05-2022,0.013439899310469627,0.0065828044898808,0.05452962964773178,0.5622311234474182,0.013167908415198326,0.06668316572904587,0.007932079955935478,0.06503187865018845,0.2104015350341797
1524942588746276883,petrogustavo,Invito a acompañar al Alcalde @quinterocalle en su lucha por defender la democracia. ,13-05-2022,0.0056525045074522495,0.0059994906187057495,0.027346793562173843,0.4777507483959198,0.007485523354262114,0.28379878401756287,0.018571412190794945,0.07978273183107376,0.09361197054386139
1524752352720338944,petrogustavo,"Hemos firmado con Andrea Padilla @andreanimalidad  senadora electa, un pacto por la vida, un Pacto Animalista.

¡Bienvenida Andrea y bienvenida siempre tu causa! ",12-05-2022,0.0023811350110918283,0.00027204968500882387,0.005292902234941721,0.9341117143630981,0.001090621342882514,0.003657050896435976,0.0007113807369023561,0.029300518333911896,0.02318263240158558
1524519178425745410,petrogustavo,El Cambio en Primera. ,11-05-2022,0.0056574540212750435,0.0056252870708703995,0.04389330372214317,0.04107362776994705,0.04754866287112236,0.23357966542243958,0.026389924809336662,0.4243834316730499,0.17184863984584808
1524491025695264768,petrogustavo,"Fusagasugá, Cundinamarca. ",11-05-2022,0.004318413324654102,0.007392333820462227,0.03440180793404579,0.04983619600534439,0.010874496772885323,0.047594960778951645,0.016611913219094276,0.28220686316490173,0.5467630624771118
1524465964280074241,petrogustavo,Ahora en Fusagasugá ,11-05-2022,0.0034766036551445723,0.0031334706582129,0.044297583401203156,0.03175579011440277,0.006964748725295067,0.3575904965400696,0.01794588565826416,0.1408098340034485,0.39402565360069275
1524437904499560448,petrogustavo,"Rompieron la Convención Americana usando una funcionaria de bolsillo del presidente, destituyendo a un funcionario, el de la segunda ciudad de Colombia. 

Si ganan ustedes los aplaudimos, si ganamos nosotros, jamas los perseguiremos como ustedes nos están persiguiendo a nosotros. ",11-05-2022,0.0006825788295827806,0.003943779040127993,0.004189556930214167,0.0793132558465004,0.0019415805581957102,0.03599286451935768,0.5520738363265991,0.16511212289333344,0.1567503809928894
1524369011357753345,petrogustavo,Gracias representante Dolcey Torres por su apoyo. Bienvenido al cambio por la Vida. ,11-05-2022,0.005376596935093403,0.0004924428067170084,0.010487870313227177,0.8528812527656555,0.004984852392226458,0.04189053550362587,0.0015549605013802648,0.038060855120420456,0.04427066445350647
1524368247017164800,petrogustavo,Cambio en primera . ,11-05-2022,0.008807417005300522,0.007833633571863174,0.05454681068658829,0.051030926406383514,0.01929139904677868,0.2675709128379822,0.061472997069358826,0.3264032304286957,0.2030426263809204
1524358709845110787,petrogustavo,"Si los y las demócratas se dividen, entregaran el país, como en 1946, a uno de los proyectos más retardatarios y sanguinarios de la historia.

En medio de la inmensa movilización popular hacia el 29M abramos las puertas del gran dialogo social.",11-05-2022,0.211452916264534,0.08968207240104675,0.009601162746548653,0.03610049933195114,0.0016217910451814532,0.061703771352767944,0.4616129696369171,0.058543961495161057,0.06968089193105698
1524358708100227077,petrogustavo,"La Paz y la Democracia, el respeto al estado de derecho de la Constitución de 1991, deben ser las piedras angulares de una unidad democrática que, indudablemente, es mayoría nacional y que debe ser gobierno, tranquilo pero firme.",11-05-2022,0.013327576220035553,0.011780010536313057,0.040900152176618576,0.06281919777393341,0.009582302533090115,0.05756119638681412,0.0070047201588749886,0.379934698343277,0.41709011793136597
1524358706904850433,petrogustavo,"Uribe, Duque y su candidato, al concentrar el poder, quieren romper la democracia con tal de perpetuarse en el poder.

Es un proyecto antidemocrático, sanguinario y tiránico para Colombia.

Hoy todas las fuerzas democráticas del país deben unirse, para derrotar la antipatria.",11-05-2022,0.001367756980471313,0.21895082294940948,0.004847752396017313,0.0011292126728221774,0.0005627317004837096,0.020933493971824646,0.7299959659576416,0.009200869128108025,0.013011342845857143
1524358705407483910,petrogustavo,"Es el estilo de gobernar tiránico del uribismo. Ha desatado la ruptura del estado de derecho robando los recursos del erario para financiar campañas, se ha articulado a las organizaciones mafiosas que asesinan, politiza las armas de la nación y rompe los fallos judiciales",11-05-2022,0.00013700163981411606,0.0072550387121737,0.003210746916010976,0.00034856743877753615,0.00015218443877529353,0.04267752915620804,0.9425866007804871,0.0022541494108736515,0.0013781714951619506
1524358704199573505,petrogustavo,"Detrás de la actual procuradora gira la matanza de presos en la cárcel modelo, la aprobación de una ley que desacató el fallo de la @CIDH eliminando votos fraudulentamente de senadores de la comisión primera y ahora este golpe de estado contra la democracia en Medellín",11-05-2022,0.000884801265783608,0.018969841301441193,0.0050979857333004475,0.0016709581250324845,0.019321845844388008,0.020819121971726418,0.9026535153388977,0.02598615363240242,0.00459575280547142
1524242542686085120,petrogustavo,"En La Alpujarra, 11 de mayo a las cinco de la tarde el pueblo de Medellín tiene la oportunidad de movilizarse para defender la democracia.

Quienes hoy sienten simpatía por mi candidatura deben priorizar la movilización popular para hacer respetar el voto popular en Medellín.",11-05-2022,0.020912272855639458,0.014104032889008522,0.03801995515823364,0.28755584359169006,0.04076160490512848,0.11726505309343338,0.022999778389930725,0.21651427447795868,0.24186718463897705
1524214334380986368,petrogustavo,"•La medidas tomadas desde el escritorio y contra el campesino tiene hoy la comida por la nubes. Para frenar este perverso ciclo, tenemos propuestas y medidas claras: ",11-05-2022,0.023506416007876396,0.21170826256275177,0.034172795712947845,0.07988496869802475,0.00479109724983573,0.05862824618816376,0.29634425044059753,0.09270547330379486,0.19825854897499084
1524212600346714115,petrogustavo,"•Vamos a acabar muchos beneficios generados por décadas de desigualdad. El bien general por encima del beneficio particular de unos pocos, debe terminar. ",11-05-2022,0.0054727159440517426,0.008392250165343285,0.03094383142888546,0.018859492614865303,0.003094335785135627,0.16067031025886536,0.10859862715005875,0.4827626943588257,0.18120570480823517
1524211897964408833,petrogustavo,•La reforma tributaria que haremos será un cambio estructural para que los 4000 más ricos del país  aporten más y ayuden a nivelar la cancha. ,11-05-2022,0.009687244892120361,0.0065425848588347435,0.13927550613880157,0.13224215805530548,0.013902058824896812,0.23064956068992615,0.017998341470956802,0.10410885512828827,0.3455936312675476
1524211701872275457,petrogustavo,"•Para romper la inequidad y construir igualdad, las grandes empresas y capitales deben tributar y aportar más ",11-05-2022,0.019726600497961044,0.017478279769420624,0.05937555804848671,0.15925365686416626,0.007237223908305168,0.3074757754802704,0.03853689134120941,0.09422197192907333,0.29669398069381714
1524211246186340352,petrogustavo,"•Seremos un gobierno amigo de los  y las emprendedores, así crecemos en empleo, oportunidades y mayor productividad en los territorios. ",11-05-2022,0.0013927678810432553,0.00036505874595604837,0.0014120190171524882,0.9345718026161194,0.0002914368233177811,0.0033216828014701605,0.0005001266836188734,0.021443311125040054,0.03670186176896095
1524211070424035329,petrogustavo,"•Recaudar más, es la política económica más inteligente y viable para el país ",11-05-2022,0.0574212484061718,0.007939225994050503,0.05083281919360161,0.13335727155208588,0.007847568020224571,0.0748964324593544,0.014996527694165707,0.08361196517944336,0.5690968632698059
1524210433393053698,petrogustavo,"•El IVA no se toca, la evasión si, así recaudamos más y mejor. ",11-05-2022,0.013703023083508015,0.0028524447698146105,0.01160463597625494,0.052147168666124344,0.0041405921801924706,0.3250325620174408,0.010989949107170105,0.03798799216747284,0.541541576385498
1524210282347876352,petrogustavo,"Estas son nuestras propuestas tributarias: 

•La política fiscal y tributaria debe fomentar la protección del ambiente. Incentivar una economía verde es el cambio económico que necesitamos. ",11-05-2022,0.020889529958367348,0.007773831952363253,0.08660627901554108,0.06880643963813782,0.08487091213464737,0.11304335296154022,0.02170567587018013,0.24285954236984253,0.3534443974494934
1524204156399067144,petrogustavo,"Pueden ver en vivo el documental ""La Política del Amor"" 

Link: ",11-05-2022,0.001772106159478426,0.001678911386989057,0.007376872934401035,0.010708078742027283,0.004155843984335661,0.7675910592079163,0.0027902491856366396,0.14034372568130493,0.06358317285776138
1524199789184827394,petrogustavo,Esto desató el golpe de Estado en Medellín: la tiranía de Duque. ,11-05-2022,0.0010042828507721424,0.0011009934823960066,0.00633924501016736,0.001082022674381733,0.0007192380726337433,0.09308099746704102,0.8803310394287109,0.014213114976882935,0.00212896429002285
1524191072343187456,petrogustavo,"Ya un procurador fascista me suspendió siendo alcalde y la sentencia de la @CIDH fue tajante: un órgano administrativo no puede suspender los efectos del voto ciudadano.

La procuradora, buscando ayudar al candidato presidencial de Duque, ha roto la Convención Americana",11-05-2022,0.008902489207684994,0.016404177993535995,0.013963206671178341,0.003232257906347513,0.022770840674638748,0.06954856961965561,0.6826414465904236,0.050998687744140625,0.1315383017063141
1524190071829770241,petrogustavo,"Golpe de Estado en Medellín. Le pido a toda la ciudadanía y a la @CIDH defender el voto popular.

La procuraduría no puede evadir el mandato popular.",11-05-2022,0.0014052361948415637,0.013755543157458305,0.0033474655356258154,0.006746938452124596,0.002442805329337716,0.03531917184591293,0.9219950437545776,0.010038872249424458,0.004948846064507961
1524169945252347904,petrogustavo,"La candidatura a la presidencia agenciada por Duque no puede basar su campaña sino sobre la base del miedo y la mentira.

He aquí otra mentira: ",10-05-2022,0.0032746230717748404,0.11136814206838608,0.03043709509074688,0.006414966657757759,0.004476004745811224,0.7364705204963684,0.03011825866997242,0.02356218360364437,0.05387821048498154
1524147919699460102,petrogustavo,"Un ministro del deporte deportista, la jornada única en los colegios con educación física, la contratación de las glorias del deporte como profesores de la niñez. Los colegios de talentos deportivos, todas las escuelas deportivas en los colegios",10-05-2022,0.011766277253627777,0.0049116299487650394,0.04169967398047447,0.0437454991042614,0.016964489594101906,0.035787902772426605,0.008656170219182968,0.5857149362564087,0.25075340270996094
1524147917103247362,petrogustavo,"Las glorias del deporte deciden su apoyo a lq campaña del Cambio por la Vida. Maria Isabel Urrutia, el tren Valencia, Willington Ortiz, Fidel Bassa, Pacho Rodriguez, Jacinto Benavente, Manuel Rincón, Chicanero Mendoza, Oscar Figueroa, Andeea Garzón, Jairo Correa, Angie Orjuela ",10-05-2022,0.004481008742004633,0.0027176158037036657,0.018527109175920486,0.019631940871477127,0.008614443242549896,0.8283966183662415,0.005853125359863043,0.0823112353682518,0.0294667836278677
1524147324733243394,petrogustavo,"Adolfo “el Tren” Valencia
María Isabel Urrutia
Willington Ortiz
Óscar Figueroa
Angie Orjuela
Fidel Bassa
Manuel Rincón
Andrea Garzón
Uvaldina Valoyes
Norfalia Carabalí

Confían en un CAMBIO por la vida y el deporte en Colombia. 

#YoHagoEquipoConPetro ",10-05-2022,0.013760450296103954,0.00740910554304719,0.0199422724545002,0.11032680422067642,0.03701001778244972,0.2161388099193573,0.023406315594911575,0.4057711958885193,0.16623498499393463
1524135112035733504,petrogustavo,@pedrohflorez Las y los esperamos a todos y todas en esta gran manifestación el 21 de mayo,10-05-2022,0.02165503427386284,0.0013459763722494245,0.017845800146460533,0.8171156644821167,0.003863902762532234,0.054094098508358,0.0101358313113451,0.011258462443947792,0.06268522888422012
1524072701559820289,petrogustavo,"EN VIVO: en #SigueLaW con Juan Pablo Calvás. 

Hablemos de propuestas puedes participa con el #PetroEnLaW 

 vía @YouTube",10-05-2022,0.011883209459483624,0.009484343230724335,0.11975116282701492,0.07030081748962402,0.021395524963736534,0.33797457814216614,0.017202692106366158,0.06501374393701553,0.34699392318725586
1524050100435181568,petrogustavo,,10-05-2022,0.0,0.0,0.0,0.0,0.0,0.0,0.0,0.0,0.0
1524047180645945344,petrogustavo,"Indudablemente el gobierno y sus fuerzas no se comportan igual si es para enfrentar a la mafia que si es para enfrentar a la juventud de los barrios populares.

",10-05-2022,0.015936922281980515,0.02115921676158905,0.0519837886095047,0.021584603935480118,0.013751639053225517,0.22490236163139343,0.04488621652126312,0.03241584822535515,0.573379397392273
1524010827598241793,petrogustavo,"La fuerza del saber con nosotros, allá, al otro lado, los corruptos.

Me enorgullece que la maestra y el maestro se vinculen a la fuerza del cambio por la Vida.

Para que Colombia sea una potencia mundial de la Vida debe ser una sociedad del conocimiento. ",10-05-2022,0.05390939116477966,0.015647392719984055,0.031787462532520294,0.45576533675193787,0.017620598897337914,0.040003255009651184,0.022701580077409744,0.11258766055107117,0.24997730553150177
1524008480289566726,petrogustavo,"Tanto la ofensiva violenta en el Caribe como la de Antioquia contra nuestra campaña solo es muestra de desesperación del gobierno.

Entre más intentan vincularnos a la violencia más la ejercen contra nosotros.

Nuestra respuesta es tranquilidad sin odios, ",10-05-2022,0.001338535570539534,0.012085518799722195,0.023154599592089653,0.022847656160593033,0.0008361117215827107,0.18136921525001526,0.1867569237947464,0.5252909660339355,0.04632052034139633
1523996344423268353,petrogustavo,"El narcotráfico crece en la medida en que se ha destruido la industria urbana y la agricultura. por eso la primera estrategia para enfrentarlo no pasa por la fuerza pública, sino por la política de crecimiento de la producción nacional.",10-05-2022,0.01263982243835926,0.08381688594818115,0.10222511738538742,0.019977644085884094,0.011602666229009628,0.23669590055942535,0.22271719574928284,0.018894042819738388,0.2914307415485382
1523996342690975748,petrogustavo,"Hoy hay organizaciones multicrimen poderosas como resultado de la misma estrategia de seguridad fracasada del gobierno. La seguridad si se aplica como una política para resolver las causas múltiples del delito, incluidas las sociales, es mucho más eficaz.",10-05-2022,0.04079802334308624,0.17341232299804688,0.21793754398822784,0.015330047346651554,0.004210661165416241,0.16478082537651062,0.10390260815620422,0.1586909294128418,0.12093707919120789
1523996340723851266,petrogustavo,"Una seguridad basada en el ""enemigo interno"", olvidando las causas sociales y múltiples del delito; la estrategia de medir la seguridad en muertos, de enfrentar al ejército con el campesino, y la policía con el joven, de extraditar sin resolver la causa del problema, ha fracasado ",10-05-2022,0.008906412869691849,0.10575459897518158,0.054185133427381516,0.014845836907625198,0.009266230277717113,0.20350868999958038,0.34491440653800964,0.11701590567827225,0.1416027545928955
1523849354683072512,petrogustavo,Valledupar inmensa por el Cambio. ,10-05-2022,0.007991772145032883,0.00399005925282836,0.16640077531337738,0.23686274886131287,0.010421336628496647,0.15441308915615082,0.1335074007511139,0.18849214911460876,0.09792063385248184
