id,user,text,date
1516559927875149834,sergio_fajardo,"Apoyaremos y ajustaremos al SENA para mejorar su calidad. Además, la educación para el trabajo estará en el centro de nuestro modelo de desarrollo. Finalmente, pero no menos importante, también en este sector haremos una revisión de cualquier riesgo de corrupción y clientelismo.",19-04-2022
1516559926700777475,sergio_fajardo,"Acceder a la universidad no será sinónimo de deudas impagables o de privilegios de pocos: reformaremos al Icetex. En nuestro gobierno el Icetex será vehículo de acceso a la universidad, más allá del otorgamiento de créditos. Nadie que no pueda pagar su crédito tendrá que pagarlo.",19-04-2022
1516559925396348930,sergio_fajardo,Aumentaremos la planta profesoral y las becas enfocadas en las poblaciones más vulnerables y en las comunidades étnicas -que son las que han sido sistemáticamente excluidas de muchas oportunidades-. #LoProgramáticoEsPolítico,19-04-2022
1516559924054183937,sergio_fajardo,Vamos a aumentar la cobertura e incrementaremos los recursos para mejorar la calidad de las universidades públicas de todo Colombia. Con educación todo se puede y es justamente en la educación superior donde está la gran oportunidad de desarrollo e igualdad. 👇🏽,19-04-2022
1516559922875486216,sergio_fajardo,"Entrar a la universidad no será sinónimo de deudas impagables o de privilegios de pocos: reformaremos al Icetex. Haremos que el Icetex sea vehículo de acceso a la universidad e irá más allá del otorgamiento de créditos. Nadie que no pueda pagar su crédito, tendrá que pagarlo. 👇🏽",19-04-2022
1516559919016730624,sergio_fajardo,"Este video es la vocación de mi vida y mi camino político: la educación. Es un orgullo que @JenniferPedraz, la líder estudiantil más importante del país -y representante electa a la Cámara- presente ideas de por qué la educación es la revolución. #LoProgramáticoEsPolítico 🧵👇🏽 ",19-04-2022
1516552063848796171,sergio_fajardo,"No puede ser que en Colombia, y especialmente en la Vía al Llano, los altos costos de los peajes sean la única forma de financiar la construcción de las vías. Esta región lleva décadas de frustración y se sienten ignorados. Vamos a trabajar por ellos. #FajardoPresidente ",19-04-2022
1516530643508809736,sergio_fajardo,"@SoyDefensor_ Santiago, muchas gracias por la confianza. Representamos una propuesta que va a unir a Colombia y me alegra que nos apoyes. Este es el momento. Un abrazo.",19-04-2022
1516522718975471623,sergio_fajardo,Con los medios en Acacías hablando de los retos que tendremos a partir del 7 de agosto para el Meta. Este departamento será la despensa agrícola de Colombia y protagonista en la transición energética. #FajardoPresidente ,19-04-2022
1516512397195939852,sergio_fajardo,"Lamento profundamente el ataque armado en Tame, Arauca, un departamento con el que Colombia está en deuda. Toda mi solidaridad con las familias de las víctimas. Es inaceptable un presidente ocupado participando en política mientras la situación de seguridad es cada vez peor. ",19-04-2022
1516470697509498881,sergio_fajardo,"Nosotros vamos a atacar la corrupción de frente, no vamos a ceder ni a pactar con corruptos. Ojalá @FicoGutierrez, en vez de limitarse a hacer populismo punitivo, empiece por rechazar a los clanes corruptos que hoy lo apoyan.",19-04-2022
1516470695437508617,sergio_fajardo,"En esta columna, Yesid Reyes reflexiona sobre las propuestas de política criminal de los candidatos, a partir del oscuro episodio de la Picota. Hablemos de ideas concretas para acabar la corrupción: que @petrogustavo arranque por responder los interrogantes que aún existen.",19-04-2022
1516470693306769408,sergio_fajardo,"Colombia quiere y se merece un cambio. Pero ese cambio no pasa por el perdón social a corruptos ni por el todo vale. La corrupción no se perdona, se combate. Y eso empieza por gobernar sin ataduras, sin encuentros oscuros y sin alianzas con corruptos. ",19-04-2022
1516452803669024769,sergio_fajardo,En Cumaral me encontré caras de sorpresa por ver a “un candidato presidencial”. Pueden acostumbrarse porque nuestro cambio será desde las regiones. Lo que no fue capaz de hacer este gobierno: gobernar fuera de la Casa de Nariño. ,19-04-2022
1516446035920527360,sergio_fajardo,"A la reunión convocada para hoy por la @PGN_Col asistirá en representación de nuestra campaña @riveraguillermo. Sin embargo, mucho me temo que después de que el gobierno y sus aliados tumbaran la ley de garantías, esta reunión no es más que un saludo a la bandera.",19-04-2022
1516422035450310671,sergio_fajardo,@gfpardo @sandia2816 @FicoGutierrez Hola Germán!  aquí puede encontrar todo nuestro programa. Saludos!,19-04-2022
1516416410179837967,sergio_fajardo,"Otro expresidente para la colección de Federico. Más de lo mismo, cada vez más lejos del cambio. ",19-04-2022
1516375889579327489,sergio_fajardo,"@petrogustavo Gustavo hay que calmarse y cuidar las palabras. Ese lenguaje es muy peligroso, genera violencia.",19-04-2022
1516375771106922498,sergio_fajardo,Vamos saliendo para el Meta con ⁦@AntonioSanguino⁩ a recorrer un departamento clave en la transformación de Colombia. ¡Nos vemos ahora! 💚💪 ,19-04-2022
1516227599457992708,sergio_fajardo,"Implementaremos el catastro multipropósito al 100% y así podremos impuestos a los grandes propietarios de tierra. Nuestro gobierno nivelará la cancha, seremos el gobierno de la igualdad. #LoProgramáticoEsPolítico",19-04-2022
1516227597813886978,sergio_fajardo,"Eliminaremos las exenciones tributarias que no tengan un efecto probado en la generación de empleo formal, para así poder reducir los impuestos que recaen sobre las pequeñas y medianas empresas. #LoProgramáticoEsPolítico",19-04-2022
1516227596719120386,sergio_fajardo,"Los que más tienen, más pondrán. Tendremos un impuesto al patrimonio para las fortunas por encima de los 5.000 millones de pesos y subiremos los impuestos a los dividendos. #LoProgramáticoEsPolítico",19-04-2022
1516227595527938062,sergio_fajardo,"Nosotros queremos que los que más tienen paguen más y que las pequeñas y medianas empresas paguen menos. Estos son algunos de los puntos más importantes de la reforma tributaria que comenzaremos a construir desde el 7 de agosto de 2022, es una cuestión de urgencia inaplazable.",19-04-2022
1516227592919072780,sergio_fajardo,"Esta cápsula es quizá la de mayor urgencia para reducir nuestras desigualdades. Un país en el que el 10% de los más ricos concentran el 60% de la riqueza total difícilmente puede construir la paz, el encuentro ciudadano y la prosperidad. #LoProgramáticoEsPolítico @ivanmarulanda ",19-04-2022
1516193091560034304,sergio_fajardo,"2. Eliminar la Procuraduría. Estas funciones las asumirá la Defensoría del Pueblo y una unidad especializada de la Fiscalía.

3. Eliminar las contralorías territoriales. El control fiscal de los departamentos y municipios lo hará la Contraloría General de la República.",18-04-2022
1516193089886601224,sergio_fajardo,"Nosotros proponemos:

1. Que el Fiscal General sea escogido por la Corte Suprema y el Contralor por el Consejo de Estado, a partir de ternas de los mejores puntajes de un concurso de méritos hecho por la facultad de derecho mejor calificada del país. 👇🏽 ",18-04-2022
1516193085751017480,sergio_fajardo,"Nunca antes había tomado tanto sentido la frase ""como se llega al poder, así se gobierna"". La corrupción se acaba con acciones concretas y propuestas claras, no con shows mediáticos. 👇🏽",18-04-2022
1516193083834175490,sergio_fajardo,"Fico va a la Picota a hacer un anuncio mediático pero no es capaz de renunciar a los apoyos de los políticos cuestionados que lo acompañan, y Petro tiene que firmar en una notaría para decir que va a cumplir su palabra de que no va a expropiar a nadie en Colombia. Patético. 🧵👇🏽 ",18-04-2022
1516094236189499394,sergio_fajardo,Creo en la libertad de empresa y creo en el liderazgo de un Estado fuerte para armonizar los esfuerzos de sus diferentes actores y lograr un crecimiento económico y social. Con el @ConsejoGremial expongo mi visión para transformar a Colombia. 🇨🇴 ,18-04-2022
1516066570774138880,sergio_fajardo,"Debemos atender el hambre en  Colombia con la ayuda de los bancos de alimentos, comedores comunitarios y programas de alimentación escolar. Pero debemos también apuntarle a la ciencia y tecnología para producir más insumos agropecuarios y alimentos en Colombia. @larepublica_co ",18-04-2022
1516065764578668547,sergio_fajardo,"Vamos a unir a Colombia con un gobierno que debe hacer una concertación amplia, escuchar a todos los sectores para avanzar. Nosotros representamos un cambio para transformar.

#EsLaEconomíaEstúpido @larepublica_co ",18-04-2022
1516063928346103809,sergio_fajardo,Vamos a hacer planes de ordenamiento productivo que tengan en cuenta las características de cada región y la oferta educativa para hacer crecer y mejorar la productividad de las empresas en los departamentos. #EsLaEconomíaEstúpido @larepublica_co,18-04-2022
1516062714656919557,sergio_fajardo,"Queremos formalizar 1 millón de micro, pequeñas y medianas empresas con asistencia técnica y acceso a crédito. A las empresas ascendentes las apoyaremos a dar un salto tecnológico, con una perspectiva exportadora. Lo hemos hecho cuando hemos gobernado. @larepublica_co ",18-04-2022
1516060889060937738,sergio_fajardo,"Debemos reducir nuestra dependencia en las materias primas, promover exportaciones y proteger nuestro ambiente. Esta apuesta se fundamenta en tres ejes: ciencia y tecnología, las pequeñas y medianas empresas y el desarrollo regional. #EsLaEconomíaEstúpido @larepublica_co",18-04-2022
1516060286050000902,sergio_fajardo,"El modelo de desarrollo que tenemos es mediocre. A pesar de nuestra riqueza, tenemos niveles de desigualdad y pobreza altísimas. Tenemos que dar un salto en el desarrollo productivo para depender menos de las materias primas. #EsLaEconomíaEstúpido @larepublica_co",18-04-2022
1516058346964541442,sergio_fajardo,Creo en la libertad de empresa. Es parte fundamental del bienestar de la sociedad. La libertad de empresa es intocable. #EsLaEconomíaEstúpido @larepublica_co,18-04-2022
1516056628646322181,sergio_fajardo,Estamos ya al aire en @larepublica_co para hablar de la economía en los hogares de Colombia. Pueden verlo en vivo aquí: ,18-04-2022
1516050479297536000,sergio_fajardo,A las 9:00 a.m. estaré en este panel individual de @larepublica_co para detallar los puntos más importantes de nuestra propuesta económica. Transmisión en vivo por redes sociales. ,18-04-2022
1516048512772935687,sergio_fajardo,Un abrazo para ti y tu familia querido Luis Gilberto. Los acompañamos en el inmwnso dolor. ,18-04-2022
1516021979278684166,sergio_fajardo,La lucha contra la corrupción empieza desde las campañas. Los que se juntan con corruptos en campaña llegarán al poder rodeados de corruptos. @lafm #UnaTrampaEs,18-04-2022
1516020847814889472,sergio_fajardo,#UnaTrampaEs que un candidato presidencial proponga eso del perdón social con presos en las cárceles y de espaldas al país. @lafm,18-04-2022
1515862153181417479,sergio_fajardo,Agradezco a @hectorabadf por cumplir su ‘penitencia’ para tener un voto 🗳 informado. Este es un programa de gobierno construido con responsabilidad y centrándonos en lo que necesita el país en los próximos 4 años. ,18-04-2022
1515828189897052160,sergio_fajardo,"Esta propuesta es solo un componente de nuestra red de protección social integral a la vejez que pueden consultar aquí:  
#LoProgramáticoEsPolítico",17-04-2022
1515828188714356742,sergio_fajardo,"En nuestro Gobierno, 3,8 millones de adultos mayores de 65 años que no pudieron pensionarse recibirán 500 mil pesos mensuales. Lo financiaremos con impuestos progresivos, no con el ahorro pensional de los colombianos y colombianas. #LoProgramáticoEsPolítico",17-04-2022
1515828187376365574,sergio_fajardo,"La vejez en Colombia, muchas veces, es indigna. El 47% de los hogares con adultos mayores sin pensión están en la pobreza. Colombia Mayor le entrega en promedio 80 mil pesos mensuales a 1,6 millones de adultos mayores sin pensión. ¡Una suma a todas luces insuficiente!",17-04-2022
1515828183895097348,sergio_fajardo,"No paramos, seguimos con nuestras cápsulas programáticas. Hoy presentamos una de las propuestas más importantes para el futuro del país: vamos a sacar a todos los adultos mayores de Colombia de la pobreza. #LoProgramáticoEsPolítico ",17-04-2022
1515806017237528578,sergio_fajardo,"@Lupeins La falta de valores, comenzando por el respeto. Saludos Luisa.",17-04-2022
1515752942996967426,sergio_fajardo,Estamos en la entrada a Bogotá por la calle 80 recibiendo a las miles de familias que regresan de Semana Santa. ¡Vamos por esa remontada! 💪🏽🇨🇴 ,17-04-2022
1515750099447603214,sergio_fajardo,Hoy la remontada es con mi dupla favorita: ¡María Ángela se lanzó al agua!💚 ,17-04-2022
1515719472761430025,sergio_fajardo,"Nosotros en lugar de convocar cabalgatas estamos comprometidos en trabajar por los derechos de los animales. Y sí montamos, pero en bicicleta. ",17-04-2022
1515687793435025410,sergio_fajardo,"5. ¿Ha existido alguna promesa de su campaña al INPEC y sus sindicatos a cambio de votos? 

6. ¿Por qué, si habla de entrampamiento ahora, antes habló del rol de Iván Moreno en su iniciativa de ""perdón social""?",17-04-2022
1515687792227098626,sergio_fajardo,"1. ¿El hermano hace o no parte de la campaña? 

2. ¿Cuándo supo de la reunión de su hermano con Iván Moreno? 

3. ¿Quién organizó esa reunión y con qué objetivo? 

4. ¿Cuál es la relación de su campaña con el INPEC y sus sindicatos?",17-04-2022
1515687790679412742,sergio_fajardo,"Tienes razón, querida Cecilia. Por eso ante la confusión creada en este lamentable episodio hay preguntas para @petrogustavo que aún no tienen respuesta: ",17-04-2022
1515676783244460032,sergio_fajardo,Las montadas en cicla me llenan de energía para retomar las giras. Ninguna cuesta es imposible de remontar. Esta semana nos vemos en el Meta y el Valle del Cauca. Feliz retorno a sus hogares. ,17-04-2022
1515540482167820296,sergio_fajardo,"Siempre Profesor. Como decimos hace años: ""con educación todo se puede"".
Y como tiene que quedar hoy más claro que nunca: CON CORRUPCIÓN NADA SE PUEDE. Juntarse con corruptos, en cárceleso clubes, para ganar una elección, es la peor expresión del todo vale. La remontada avanza. ",17-04-2022
1515522427027087370,sergio_fajardo,"@alemarchetti91 Alessandro, lo invito a leer nuestro programa de gobierno  Nuestra experiencia en Medellín y Antioquia es la mejor carta de presentación para decirle que nuestros compromisos serán hechos para cambiar a Colombia. Saludos!",17-04-2022
1515499916818325505,sergio_fajardo,@CarlosAmayaR @DanielaAssisF Remontando y alistándose para volver el lunes con toda 💯,17-04-2022
1515498909250080770,sergio_fajardo,"Muy selectiva tu memoria, Gustavo. Muchas veces no solo no me has apoyado, sino que has liderado los ataques, aún ante mis explicaciones claras. Las tuyas, en cambio, siguen sin ser satisfactorias: existen aún preguntas sin respuesta. Y no, la corrupción no admite perdón social.  ",17-04-2022
1515497594218332162,sergio_fajardo,"@CaroEspitiaJ @CarlosAmayaR @Wilmerlealp @1roEnPolitica @ELDIARIOBOYACA @boyacasietedias @chidonoticias @tvboyacasanare @noticiaslalupa @CaracolRadioTun @BoyacaRCNRadio Bien, fortalecimiento para #LaRemontada 🚵 #FajardoPresidente",17-04-2022
1515471042105516033,sergio_fajardo,"Las burocracias se crean en función de quien lidera. Si se llega al poder con el clientelismo de siempre, tendremos la burocracia de siempre. Si se llega con gente que no le debe nada a nadie, será un ministerio que transforme. #LoProgramáticoEsPolítico",16-04-2022
1515471040805314560,sergio_fajardo,"Urge un ministerio con poder para movilizar recursos para la igualdad y derechos de las mujeres,  invertir en infraestructuras de cuidados, compromisos de Acuerdo de Paz, garantizar acceso de las mujeres a la justicia, promover cambios culturales y participación efectiva.",16-04-2022
1515471039484121105,sergio_fajardo,"La búsqueda de igualdad debe ser prioridad en todos los ministerios y agencias del Estado y esto lo debe lograr un ministerio fuerte que convoque, optimice y haga seguimiento. #LoProgramáticoEsPolítico",16-04-2022
1515471038150287363,sergio_fajardo,"Estoy convencido de que se necesita una instancia al más alto nivel que defina metas, coordine acciones y responda por cerrar las diversas brechas de género. #LoProgramáticoEsPolítico",16-04-2022
1515471033188630529,sergio_fajardo,"Lo hicimos en Medellín y Antioquia, ahora lo haremos en Colombia. El enfoque de género aparece de forma transversal en nuestras 32 propuestas de gobierno, el Ministerio de las Mujeres coordinará acciones cruciales en el tema. Aquí lo explica @cataortizco #LoProgramáticoEsPolítico ",16-04-2022
1515321915111616527,sergio_fajardo,Unos pactan con condenados por corrupción que aún están en las cárceles y los otros con condenados que están libres. No todo vale en política y menos buscar votos de la mano de corruptos en cárceles o clubes. ¿No serán capaces de rechazar claramente esos apoyos ? ,16-04-2022
1515309726661238789,sergio_fajardo,"@14lLaita91 Claro que sí, estaremos subiendo todo a YouTube. Acá te comparto la lista de reproducción. Un abrazo. ",16-04-2022
1515146977155104768,sergio_fajardo,"Otro gran ciclista que nos deja: El santadareano Severo Hernández Tarazona. Paz en su tumba. 
",16-04-2022
1515109140376571910,sergio_fajardo,"No más promesas incumplidas, nosotros lo haremos finalmente llevaremos del 0,3% al 1% del PIB la inversión en ciencia, tecnología e innovación. Estamos convencidos de que allí está nuestra riqueza y nuestras mayores posibilidades. #LoProgramáticoEsPolítico",15-04-2022
1515109139206311945,sergio_fajardo,"Haremos que Colombia crezca y sea reconocida por lo más valioso: el talento de las personas, el desarrollo científico y por las posibilidades de crecimiento de la economía popular. #LoProgramáticoEsPolítico",15-04-2022
1515109137902112768,sergio_fajardo,"Estos centros van a dar un rol protagónico a los científicos y científicas del país, pero además conectarán el conocimiento universitario, público, empresarial para dar soluciones aplicadas al sector productivo que repercutirán en mejores oportunidades para todas las personas.",15-04-2022
1515109133837824000,sergio_fajardo,"👩🏻‍🔬🧑🏽‍🔬 ¡Va la primera cápsula del programa de gobierno! Ciencia y tecnología para impulsar los sectores productivos, la generación de empleo 💪 en nuevos sectores ♻️ y en el mejoramiento del bienestar social🤝. #LoProgramáticoEsPolítico 🧵👇🏽 ",15-04-2022
1514983718817042439,sergio_fajardo,"@El_joinca Y en Barranquilla mucho mejor. Un abrazo, Mono! 🌞",15-04-2022
1514962877081432064,sergio_fajardo,@jobtips_ @petrogustavo @FicoGutierrez Hicimos la tarea y contestamos. Muchas gracias @jobtips_ por la oportunidad. Les comparto el hilo: ,15-04-2022
1514960195717410829,sergio_fajardo,Pueden leer nuestras propuestas en este enlace  Muchas gracias a @jobtips_ por esta invitación.,15-04-2022
1514960194593333258,sergio_fajardo,"5. Invirtiendo en infraestructura social a través del Sistema Nacional de Cuidados para reducir la carga de trabajo doméstico y de cuidados que recae sobre las mujeres, para facilitar su inserción en el mercado laboral.",15-04-2022
1514960193427226633,sergio_fajardo,"4. 3x el gasto en I+D con 5 centros de investigación en sectores del futuro: transición energética, salud, bioeconomía, agroindustria y lucha contra el cambio climático. Esta inversión generaría el doble de empleos que los generados por la infraestructura energética actual.",15-04-2022
1514960191959228422,sergio_fajardo,3. Insistiendo en la educación y formación para el trabajo. Es necesario armonizar las demandas del mercado con la oferta educativa y laboral. Aumentaremos la cobertura de aprendices SENA en 150 mil. 100 mil cupos en la Universidad Digital para municipios sin cobertura educativa.,15-04-2022
1514960190612951044,sergio_fajardo,"2. Apoyando a 100 mil empresas que serán beneficiarias del programa Fábricas de Productividad, acompañamiento y difusión del conocimiento porque no es suficiente otorgar créditos si no hay acompañamiento en el crecimiento de las MIPYMES.",15-04-2022
1514960189111349256,sergio_fajardo,"Lo haremos: 1. Poniendo el músculo del Estado al servicio de la generación de empleo, dándole continuidad a los grandes proyectos de infraestructura: 4G, 5G, vías terciarias, 1,2 millones de soluciones de vivienda.",15-04-2022
1514960187978919944,sergio_fajardo,"Nuestra meta es generar 1,5 millones de empleos formales promoviendo nuevos sectores que impulsen la actividad productiva y la generación de empleo, garantizando la seguridad alimentaria y la sostenibilidad ambiental. 👇🏽",15-04-2022
1514960186141782018,sergio_fajardo,"El crecimiento económico de 🇨🇴 no se ha traducido necesariamente en bienestar social. 16 millones de colombianos no alcanzan a tener 3 platos de comida al día, 1 de cada 3 jóvenes no estudia ni trabaja, y la brecha de desempleo entre mujeres y hombres cada vez es mayor. 🧵👇🏽 ",15-04-2022
1514958314681118723,sergio_fajardo,"Qué buen recuerdo. Cómo pasan los años (obviamente para mí 😂). El mejor regalo para un profesor es el cariño y el recuerdo de un estudiante, es nuestra forma de saber que dejamos una huella positiva. Un abrazo grande Indira! ",15-04-2022
1514740408840032256,sergio_fajardo,"Sin duda tenemos las mejores propuestas. Poco se habla del tema en estos días del todo vale, pero es con este trabajo que cambiaremos a Colombia. Cada día una idea en un video corto. No estamos condenados a lo mismo, podemos construir un país diferente #LoProgramáticoEsPolítico ",14-04-2022
1514693301663899657,sergio_fajardo,"Para quienes quieren un cambio, pero no están dispuestos a tragarse el sapo de concederles 'perdón social' a los corruptos, los invito a unirse a mi campaña. No vamos a permitir un Pacto de La Picota en Colombia. Súmate 👉🏽  #ConFajardoNoTragamosSapos ",14-04-2022
1514669446689968129,sergio_fajardo,"@ImSergioCal Gracias Sergio! Cada vez sumamos más apoyos, y el tuyo es igual de valioso. Un abrazo, vamos a ganar.",14-04-2022
1514647654852182020,sergio_fajardo,"Me alegra ver a tantas personas en las calles para vivir la Semana Santa. Recuperar el tiempo perdido de la mano de la gente, no a escondidas haciendo pactos de espaldas al país. ",14-04-2022
1514587557090181122,sergio_fajardo,Madrugamos como las miles de personas que hoy visitan Monserrate en Bogotá. Vamos por un canelazo y seguimos para arriba. 😁🇨🇴 ,14-04-2022
1514551787113566216,sergio_fajardo,"Fredy Rincón, 19 de junio de 1990: el gol más importante, y hermoso, de la historia de Colombia. Para siempre en nuestros corazones. Gracias. Descansa en paz. ",14-04-2022
1514431245328998400,sergio_fajardo,@DilanNeira0 @Camiloenz @RobynsonJ @JenniferPedraz @DaniQuinonezL @CoaliEsperanza @dignidad_col @gustavotrianasu @LuisGMurillo @JERobledo Gracias Dilan 👏👏,14-04-2022
1514426258175795217,sergio_fajardo,@DeboraEscudero @CLunaCha 👏👏👏💚,14-04-2022
1514396703595630602,sergio_fajardo,"Misión cumplida. Excelentes 3 días en el Eje Cafetero. No nos van a sacar, no nos van a arrodillar: la remontada avanza. Seguimos pedaleando con los equipos de la coalición que  trabajan al unísono. Gracias. ",14-04-2022
1514391183098789891,sergio_fajardo,¿Perdón social? #ConFajardoNoTragamosSapos Cero tolerancia con quienes buscan votos con la corrupción. #FajardoPresidente ,13-04-2022
1514378319260700672,sergio_fajardo,Encontrarse con la gente en las calles es la mejor forma de recargar energía para #LaRemontada. Muchas gracias Calarcá por el apoyo y el afecto. #FajardoPresidente ,13-04-2022
1514336671126499332,sergio_fajardo,@14lLaita91 @CoaliEsperanza Muchísimas gracias Lulú! He seguido tus aportes y comentarios y con tu apoyo lograremos la victoria. Un abrazo grande para ti.,13-04-2022
1514334590734938113,sergio_fajardo,"@socifono Gracias por el interés, ¡necesitamos más Guardianes de la Esperanza! Te dejo el link para que lo compartas con todas y todos que quieran apoyarnos ",13-04-2022
1514333547372462080,sergio_fajardo,Nada como la alegría de la gente 👏🏻😅 ,13-04-2022
1514286450942132235,sergio_fajardo,"No nos traguemos esos sapos ni esos cuentos. Ni en las cárceles ni en los clubes. Contra la corrupción, sanción social, no perdón social. ",13-04-2022
1514270336442941458,sergio_fajardo,"@Margaritarosadf Con lo corrupción no hay perdón social, hay sanción social.",13-04-2022
1514236754722803721,sergio_fajardo,A la entrada del periódico La Crónica del Quindío se puede leer esta frase de Aleida (Valddo). A propósito del periodismo en estos tiempos turbulentos. ,13-04-2022
1514234621881458689,sergio_fajardo,"Hoy desde Armenia. En esta esquina está una de mis librerías favoritas en Colombia!. La remontada va, no nos van a sacar. Buen día ",13-04-2022
1514227720678428675,sergio_fajardo,"Tercer día de gira en el Eje Cafetero y lo terminamos en Calarcá y Armenia, con buen café y el apoyo de la gente de Quindío. ¡Ya nos vemos! #LaRemontadaTour 🚴🏼🇨🇴 ",13-04-2022
1514079468368838657,sergio_fajardo,@slondonouribe 😵‍💫,13-04-2022
1514059115957477376,sergio_fajardo,@fdbedout @luisbernardov Un diccionario al que todos los días le suman una página.,13-04-2022
1514057638643916800,sergio_fajardo,@eduardoluisdlv @EliCrH ,13-04-2022
