id,user,text,date
1500806794364522496,sergio_fajardo,Buenos días. Al aire en minutos en @WRadioColombia para que sintonicen. En línea por  ,07-03-2022
1500622567782203397,sergio_fajardo,"Colombia necesita a @DeLaCalleHum en el Senado. Su carácter, su profundo conocimiento del país, su compromiso con la paz y su decencia son esenciales para iniciar el cambio en el Congreso. Qué orgullo que sea el #1 de la lista Alianza Verde Centro Esperanza. ",07-03-2022
1500592313583779842,sergio_fajardo,La calle es nuestra sede y hoy estuvimos en Suba escuchando las preocupaciones y explicando nuestras propuestas a la ciudadanía. Conózcanlas en  y el próximo 13 de marzo elijan el rigor y la experiencia en el tarjetón de la @CoaliEsperanza. ,06-03-2022
1500570957429231618,sergio_fajardo,"Moisés Wasserman, Juan Gabriel Vásquez y Gustavo Bell simbolizan el rigor intelectual y la creatividad en tres mundos: académico, cultural y público. Estoy orgulloso de tener su apoyo. Con personas inspiradoras como ellos cambiaremos el país. Primer paso: votar el 13 de marzo. ",06-03-2022
1500534619833307140,sergio_fajardo,"Las promesas falsas y andar golpeando o amenazando a la gente puede ser llamativo, pero no es como se transforma un país. El cambio se logra con seriedad, experiencia y sin acuerdos clientelistas. Nos nos volvamos a equivocar. ",06-03-2022
1500513209652031488,sergio_fajardo,"Nunca en mi vida he hecho acuerdos con clientelistas y corruptos que después hay que pagar cuando se llega al poder. Este 13 de marzo ganaremos de manera limpia la consulta. @elcolombiano

",06-03-2022
1500511414859046922,sergio_fajardo,@nelzalez @DeLaCalleHum @davalho @CoaliEsperanza Gracias Nelson por la confianza. Con @davalho y con @DeLaCalleHum Colombia va a cambiar. Un abrazo!,06-03-2022
1500509925755297803,sergio_fajardo,"@Ccupitre @MJDuzan @DeLaCalleHum @MarthaAlfonsoJ Gracias por el apoyo, Mauricio. Firmes este 13 de marzo. Un abrazo!",06-03-2022
1500489648707186689,sergio_fajardo,Siempre hay que leer con atención a Alonso Salazar. Un breve repaso a la historia de las últimas décadas de Medellín. ,06-03-2022
1500261252043624455,sergio_fajardo,"Necesitamos mucha pedagogía de cómo votar el próximo 13 de marzo en las consultas: primero, hay que pedir el tarjetón de la coalición Centro Esperanza; luego, ¡arriba, al centro y pa' dentro! ",06-03-2022
1500247469573255171,sergio_fajardo,"Aprendí a hacer política en la calle. Cualquiera puede acercarse y preguntarme lo que quiera y responderé con respeto. No creo que la política sea de agredir, maltratar o insultar para parecer valiente; creo en la educación y la decencia, que es el camino que Colombia necesita. ",05-03-2022
1500199830337040385,sergio_fajardo,"Me enorgullece trabajar con @VivianaBarbere porque compartimos los sueños de @AntanasMockus: no todo vale, los recursos públicos son sagrados, la vida como valor supremo y la educación como base de la sociedad. Invito a que la apoyen el 13 de marzo. La necesitamos en el Senado. ",05-03-2022
1500178484043341827,sergio_fajardo,"Mientras unos quieren que todo siga igual para que no se acabe la mermelada, otros prometen el cambio abrazando el clientelismo y la corrupción. El próximo 13 de marzo pida el tarjetón de la coalición Centro Esperanza y elija la decencia para transformar nuestro país. ",05-03-2022
1500157773379743746,sergio_fajardo,"El caso del senador liberal Mario Castaño es un ejemplo aterrador y descarado de clientelismo y corrupción. ¡Y será reelegido! Como (y con quienes) se llega al poder, se gobierna. Por más que los maquillen, son la empresa criminal más difícil de combatir.

",05-03-2022
1500124742908624903,sergio_fajardo,Con personas como @AntanasMockus hemos luchado por años contra la corrupción y el clientelismo en Colombia. El primer paso para derrotarlos es salir masivamente el 13 de marzo a votar con esperanza y convicción. Vamos a demostrar que la educación es la verdadera revolución. ,05-03-2022
1499918130293977097,sergio_fajardo,"Cali está agobiada y necesita recuperar su autoestima. Apoyaré el desarrollo del tren de cercanías para demostrar que tiene toda la capacidad de sacar adelante grandes proyectos de infraestructura. Conmigo de presidente, lo lograremos. ",05-03-2022
1499866463020199938,sergio_fajardo,"Agradezco a María Camila Roncería, quien donó su tiempo y voz para este video.",04-03-2022
1499863958735441927,sergio_fajardo,"Estamos a nada de transformar profundamente a Colombia. Salgamos a votar masivamente el 13 de marzo para no quedarnos en las excusas, que nuestra motivación ese día sea el cambio y la esperanza. A Colombia le sobra talento y riqueza. ¡Con educación y principios todo se puede! ",04-03-2022
1499850539718348802,sergio_fajardo,"Agradezco las palabras de Juan Gabriel Vásquez, escritor a quien admiro profundamente. Nuestra propuesta de cambio para Colombia parte de la experiencia y preparación. Estoy de acuerdo, en nuestro país la ""serenidad no sólo es deseable, sino urgente"".

",04-03-2022
1499794784222916615,sergio_fajardo,Me reuní con alumnos de la @UNIAJC para hablar de nuestras propuestas educativas: ampliaremos el programa Jóvenes en Acción a 1.000.000 de beneficiarios para que sigan estudiando e implementaremos rutas de empleo para 1.500.000 jóvenes del país. La educación es la revolución. ,04-03-2022
1499757840101265409,sergio_fajardo,"En el momento más traumático y difícil de los últimos tiempos, a Cali le pasó lo peor: que no tuvo alcalde ni tuvo presidente durante el paro nacional. ",04-03-2022
1499742387035422720,sergio_fajardo,"Colombia va a cambiar, sin depender de los mismos políticos de siempre ni con promesas falsas. Este 13 de marzo pidan el tarjetón de la consulta Centro Esperanza y voten por mí para comenzar la transformación que el país necesita. ",04-03-2022
1499707509732433923,sergio_fajardo,Buenos días. Regresamos a Cali para seguir presentando nuestras propuestas a los medios y la ciudadanía. Vamos a transformar al Valle del Cauca y a Colombia con educación. ,04-03-2022
1499567023109591052,sergio_fajardo,"Lanzamos nuestro programa de gobierno hace unos días y están 3 documentos exclusivamente sobre la equidad de género. Además, todas nuestras propuestas tienen este enfoque porque creemos que debe ser integral y transversal el abordaje. Invito a leer en: ",04-03-2022
1499567021742346245,sergio_fajardo,"Integraremos a las mujeres en procesos formativos para que desarrollen habilidades básicas, competencias laborales, protegerse de la violencia intrafamiliar y evitar la deserción escolar. Las comisarías de familia con enfoque de género serán claves para abordar la violencia.",04-03-2022
1499567020228194305,sergio_fajardo,"Conectaremos al sector educativo para que la reducción del embarazo adolescente y reducción de violencias contra las mujeres sea la prioridad central en todas las sedes educativas del país, de la mano del liderazgo de maestras y maestros e involucrando a los padres de familia.",04-03-2022
1499567018802094084,sergio_fajardo,"Tenemos una visión integral para atacar el problema de raíz: educación, oportunidades, salud, justicia. Vamos a promover todas las acciones necesarias para impulsar y expandir la salud sexual y reproductiva de niñas, jóvenes y mujeres. Solo ellas las deciden sobre sus cuerpos.",04-03-2022
1499567016189038592,sergio_fajardo,"Johanna, gracias por la pregunta. El embarazo adolescente en el país nos preocupa sobremanera. Organizaciones como la tuya son fundamentales. Como gobierno vamos a trabajar con la sociedad civil para atacar este problema que le roba los sueños a las niñas y jóvenes del país. 👇🧵 ",04-03-2022
1499536769439744001,sergio_fajardo,"Podemos mirar a las personas a los ojos porque somos libres y no le debemos nada a ningún poderoso. Por eso generamos esperanza: porque podemos cumplir la promesa de un cambio real sin clientelismo, con seriedad y experiencia.

 ",04-03-2022
1499513678491750404,sergio_fajardo,"En Neiva he sentido el apoyo de la gente por nuestras propuestas y nuestra invitación a construir la Colombia que soñamos. Este 13 de marzo ganaremos la primera etapa de las tres que tenemos por delante.

 ",03-03-2022
1499502423777243142,sergio_fajardo,"El Huila es el mayor productor de café del país y en mi gobierno vamos a agregarle valor a esa producción: formaremos una nueva generación cafetera e impulsaremos oportunidades con productos especiales, tostadores, cata, barismo y turismo para generar riqueza, como en Antioquia. ",03-03-2022
1499419527595053062,sergio_fajardo,"Muchas gracias a Gustavo Bell por su apoyo y confianza. Con él y otras muchas personas más trabajaremos para hacer que el Caribe brille por su talento, la calidad de su educación, su riqueza cultural y su gente. ",03-03-2022
1499403168085688322,sergio_fajardo,"Duque cantó su voto y ratifica que el 13 de marzo la elección es entre el equipo duquista, el Pacto Histórico donde Petro ningunea a sus compañeros para abrazarse con políticos de siempre y nosotros, que somos la alternativa del cambio serio que va de frente contra los corruptos. ",03-03-2022
1499366564222623744,sergio_fajardo,"Yo me comprometo a que los organismos de control sean independientes de mi gobierno. No aguantamos más fiscales, procuradores y contralores de bolsillo y al servicio de las cuotas a congresistas. Esa voluntad política hará una gran diferencia. ",03-03-2022
1499364839415820288,sergio_fajardo,"La inseguridad en Colombia es impresionante. Otra promesa fallida de Duque que mejoraremos cumpliendo el acuerdo de paz, resolviendo que los delincuentes no queden libres a las 24 horas, reformando la Fuerza Pública y generando oportunidades para jóvenes cayendo en la ilegalidad. ",03-03-2022
1499353948133728257,sergio_fajardo,Buenos días. Llegamos a Neiva para hablar con la ciudadanía y presentarles nuestra propuesta de gobierno. Con educación todo se puede en el Huila. ,03-03-2022
1499185270868094979,sergio_fajardo,"Gracias a @AntanasMockus entré a la política: abrió el camino y me inspiró. Es el referente más importante de honestidad, lucha contra la corrupción y educación del país. Siento un orgullo tremendo de recibir su apoyo. ¡Juntos demostraremos que la educación es la revolución! ",03-03-2022
1499093836013965317,sergio_fajardo,"La corrupción debe enfrentarse desde las campañas para tomar decisiones con libertad en el gobierno. Haremos el mapa de la corrupción en la gestión carcelaria para reformar el INPEC, para frenar esa cultura arraigada que dice que con plata todo se puede, porque todo tiene precio.",02-03-2022
1499036833405153283,sergio_fajardo,"Hay quienes gritan e insultan para llamar la atención. Yo soy profesor y estoy acostumbrado a dar ejemplo. Mientras unos creen que están en un reality, yo sé muy bien que estoy aspirando a la presidencia. El camino que estoy recorriendo es serio y sereno, sin rabia ni odio. ",02-03-2022
1499021594685054980,sergio_fajardo,"Tengo dos Gavirias encima y en gavilla. No les voy a gastar más energía, porque lo que importa es cómo proponemos transformar a Colombia.

",02-03-2022
1499014861740773378,sergio_fajardo,"Mi padre fue liberal, toda mi familia es liberal. Los liberales no son un rebaño, son rebeldes, quieren cambio y no siguen las órdenes de un señor. Yo invito a todos los liberales a votar por mí y que por favor no lo hagan por la corrupción. ",02-03-2022
1499011734824271877,sergio_fajardo,A aire en @rcnradio. Escuchen la entrevista en ,02-03-2022
1499006949542838277,sergio_fajardo,"En Bogotá hay miedo de salir a las calles. Necesitamos más presencia policial, mejor inteligencia para desarticular las redes criminales y mayor efectividad en las judicializaciones.

Esta es nuestra propuesta de seguridad y defensa:  ",02-03-2022
1499002846775291904,sergio_fajardo,"Ya tenemos 31 propuestas para transformar a Colombia. Somos los primeros en presentar un plan de gobierno completo. Miren las otras opciones que dicen que van a cambiar el país, abrazados con los de siempre.

Conozcan nuestras propuestas aquí: ",02-03-2022
1499000798365339654,sergio_fajardo,"Voté en blanco porque no era con Duque ni Petro que iba a darse un cambio, y el tiempo me da la razón. Llevan años insultándome por eso y no he caído en la trampa de agredir a quienes me critican eso. Esta condición me permitirá gobernar porque sé construir, dialogar y respetar.",02-03-2022
1498999856727306243,sergio_fajardo,Como alcalde y como gobernador fui el mejor en transparencia. Yo llevo 22 años enfrentando a los corruptos y no les tengo miedo ni me les acomodo para ganar. Por eso me persiguen con acusaciones falsas. Soy una amenaza para ellos. @LaCarinosa610AM,02-03-2022
1498998483465953280,sergio_fajardo,"Duque, el heredero de la seguridad democrática, nos entrega el país sumido en una profunda inseguridad. Se hizo elegir con el miedo a convertirnos en una Venezuela y nos deja con miedo de ser atracados en las ciudades o de ser amenazados en el campo. ",02-03-2022
1498989491209576451,sergio_fajardo,Buenos días. Hoy estaré en las calles de Bogotá para que hablemos y les pueda contar cómo vamos a transformar a Colombia con propuestas serias y concretas. ,02-03-2022
1498818114733150209,sergio_fajardo,"La mejor forma de luchar contra la corrupción es votando para que los corruptos no lleguen al poder. Comparto un breve resumen de mi visita a Ibagué, donde compartí este mensaje.

 ",02-03-2022
1498806562164514816,sergio_fajardo,"Algunos decían que no teníamos ideas, que no proponíamos.¡Falso!Llevamos años presentando ideas. Este trabajo no es solo mío, es de cientos de personas que saben que no estamos condenados a lo mismo, se puede hacer política diferente. Acá nuestro programa:  ",01-03-2022
1498775082696646662,sergio_fajardo,"@dianalizethp @davidbautistaqf @AngelicaLozanoC @ArielAnaliza @JenniferPedraz Diana, muchas gracias por tu confianza. Un abrazo.",01-03-2022
1498775010386878477,sergio_fajardo,"@DiegoEGuio @davidbautistaqf @ivanmarulanda @DaniQuinonez110 Diego, un abrazo muy grande y muchas gracias por tu apoyo para este 13 de marzo.",01-03-2022
1498771839006523393,sergio_fajardo,"@PedroMCol @CoaliEsperanza @Juan_Florez @ferrojasparra @agaviriau @riveraalzate @JuanitaGoe @DeLaCalleHum @FirmesCCE @CeciliaLopezM Gracias Pedro por tu apoyo, un abrazo.",01-03-2022
1498771704881065986,sergio_fajardo,"@J_P_Artunduaga @DiegoFuerteB @AngelicaLozanoC @PartidoVerdeCoL @CoaliEsperanza @DaniQuinonez110 Jean Paul, muchas gracias por la confianza. Ganaremos este 13 de marzo para cambiar a Colombia. Un abrazo.",01-03-2022
1498746489174216704,sergio_fajardo,"A @mwassermannl lo conocí hace años luchando por la educación y la ciencia en Colombia. Recibir su apoyo es un gran orgullo, seguimos con los mismos ideales y con la convicción profunda de que la educación, la ciencia, el conocimiento son el motor de la transformación. ",01-03-2022
1498743054378930182,sergio_fajardo,De nuevo en la calle es conversando con las personas. Estuvimos en la carrera tercera de Ibagué hablando de la importancia de votar el próximo 13 de marzo. Elegir bien al Congreso y en las consultas es la mejor forma de luchar contra la corrupción. ,01-03-2022
1498711207901114370,sergio_fajardo,"Sobre tu pregunta de las inversiones de privados en zonas de conflicto o de alta biodiversidad, estamos haciendo referencia a mecanismos como conformación de alianzas productivas entre los pequeños productores y los inversionistas privados, entre otros. (3/3)",01-03-2022
1498711206202429446,sergio_fajardo,"El compromiso de entregar (y titular) 3 millones de hectáreas puede incluir baldíos, para lo cual es clave, entre otros, implementar al 100% el catastro multipropósito. Dicha entrega debe proteger las áreas de reserva forestal (no realizar nuevas sustracciones). (2/3)",01-03-2022
1498711203631321095,sergio_fajardo,"Juan Diego, gracias por leer la propuesta y por tus comentarios. Sobre baldíos/titulación/entrega de tierras, nuestro compromiso, como lo mencionamos en el documento, es cumplir con el Acuerdo de Paz. 👇🧵 (1/3) ",01-03-2022
1498709630142369797,sergio_fajardo,"Gracias Érika por leer la propuesta. La invisibilidad ha sido estadística y también ha habido indiferencia estatal por años con los temas relacionados con las comunidades negras, afrocolombianas, raizales y palenqueras. Colombia solo cambiará si rompemos con esta injusticia. ",01-03-2022
1498699161029554186,sergio_fajardo,"Gracias por leer la propuesta y las sugerencias, @14lLaita91. ¡De acuerdo! Hay que promover el interés por las artes y la cultura. Interesante ej que mencionas de Tocancipá. Revisaremos para mejorar la propuesta. Estoy convencido de que la cultura es clave para cambiar al país. ",01-03-2022
1498682263780958217,sergio_fajardo,"@ferdeejay @PorqueAJAAA Aquí, @ferdeejay:  Gracias.",01-03-2022
1498667910931300358,sergio_fajardo,"Los que reciben el apoyo de los corruptos en las elecciones creyendo que después van a gobernar con transparencia, se equivocan. Ningún corrupto invierte en una campaña para que después lo saquen. Quienes hacen alianzas con la corrupción, gobiernan con la corrupción. @ElOlfato ",01-03-2022
1498653569339342850,sergio_fajardo,Al aire en @lafm. Pueden escuchar la entrevista en ,01-03-2022
1498640931662311425,sergio_fajardo,"La corrupción está en todos lados: en la educación, la infraestructura y la salud. La afrontaremos en cada sector. Con muchos ojos y pocas manos, haciéndole seguimiento a la contratación pública. Aquí pueden leer nuestra propuesta anticorrupción: ",01-03-2022
1498634542965530624,sergio_fajardo,Nuestro país tiene rabia con la corrupción y el mal gobierno. A eso se le suma el miedo que genera la inseguridad y el desempleo. Vamos a lograr el cambio que Colombia reclama alejados de los políticos que creen que el país es su billetera. @EcosdelCombeima,01-03-2022
1498477166383747073,sergio_fajardo,"Humberto, estoy convencido de que llegarás al Senado para darle altura al debate, a las ideas. Has sido y seguirás siendo pieza clave en la construcción del país que nos soñamos. A Colombia la vamos a cambiar juntos. ",01-03-2022
1498473635073429504,sergio_fajardo,"Querido Iván, gracias por este valioso apoyo y por la amistad. Después de tantos años seguimos caminando y buscando la transformación de nuestro país, luchando contra las desigualdades. Tu voz en el Senado será esencial para cambiar este país desde los argumentos y la convicción. ",01-03-2022
1498467225073860611,sergio_fajardo,"Muchísimas gracias, Andrea. Soñamos con una Colombia llena de oportunidades. El 13 de marzo lo demostraremos en las urnas. Un abrazo. ",01-03-2022
1498466947025051652,sergio_fajardo,"@14lLaita91 Lulú, muchas gracias por tus comentarios. Fueron meses de trabajo para desarrollar un plan para construir y transformar a Colombia. Nuevamente gracias y feliz noche.",01-03-2022
1498465107927613443,sergio_fajardo,@LiamPayker @14lLaita91 Gracias Liam por tu apoyo. Vamos a seguir trabajando sin descanso para cambiar a Colombia. Un abrazo.,01-03-2022
1498453299745505291,sergio_fajardo,"Todos los comentarios son bienvenidos en propuestas@sergiofajardo.co

Desde 14 de marzo recogeremos las ideas de nuestros compañeros de coalición y los comentarios que recibamos, para hacer de este el programa de gobierno con el que, juntos, vamos a cambiar a Colombia.",01-03-2022
1498449750789705732,sergio_fajardo,"Tengo una emoción muy grande, muchos meses de trabajo y con muchas personas comprometidas hoy presentamos todas nuestras ideas. No tengo dudas: tenemos las mejores propuestas. Las pueden conocer en  Esta es la Colombia que me sueño, Colombia va a cambiar. ",01-03-2022
1498437393535447040,sergio_fajardo,"Colombia está llena de clanes dedicados a comprar votos para ganar elecciones, repartirse contratos y el poder. Con ellos nunca habrá cambio. Nosotros hemos demostrado que se puede gobernar bien, de otra forma, sin arrodillarse ante nadie y que solo así se transforma la sociedad. ",28-02-2022
1498435641352368130,sergio_fajardo,Gracias Nicho por tomarte el tiempo de leer la propuesta de turismo. Anotamos tus comentarios para discutirlos internamente. Si tienes más observaciones puedes enviarlas a propuestas@sergiofajardo.co ,28-02-2022
1498390011913412613,sergio_fajardo,"Este encuentro resume todo lo malo que tiene la política: un expresidente vendiendo su maquinaria al mejor postor y un candidato presidencial que promete ""derrocar el régimen de la corrupción"" con los mismos que lo estimulan. De la forma como se llega al poder, así se gobierna. ",28-02-2022
1498346174939549698,sergio_fajardo,"La corrupción es tan o más dañina que la violencia porque se roba nuestras oportunidades y limita nuestro desarrollo. Con integridad, eficiencia, transparencia y el poder de la decencia, la vamos a derrotar.

Lea nuestra propuesta aquí: ",28-02-2022
1498335226917007362,sergio_fajardo,"Colombia tiene miedo. Pero con nuestra propuesta integral de seguridad, que prioriza los derechos humanos y el respeto a la vida, le devolveremos la tranquilidad al país:  ",28-02-2022
1498329367365263365,sergio_fajardo,"Vamos a poner a la educación, la ciencia y la tecnología al servicio del desarrollo empresarial con cinco centros de desarrollo en agricultura, cambio climático, bioeconomía, industria y salud:  ",28-02-2022
1498325785702285317,sergio_fajardo,"Hoy tras intensos meses de trabajo, con 19 mesas programáticas y el apoyo de más de 150 personas, presentamos nuestra propuesta de gobierno para lograr la transformación de Colombia. La totalidad de la propuesta se encuentra en nuestra página web ",28-02-2022
1498293972015452161,sergio_fajardo,Seguimos en @BesameFM. Pueden escuchar el programa en ,28-02-2022
1498280038021615624,sergio_fajardo,Ahora estamos al aire en @OxigenoFM. Escuchen la entrevista en ,28-02-2022
1498269699729244163,sergio_fajardo,Buenos días. Al aire en @TropiBogota 102.9 FM para hablar de nuestras propuestas. Transmisión en vivo aquí:  ,28-02-2022
1498101928890306560,sergio_fajardo,"Volví a Ituango. Una jornada emocionante, donde recordamos con la comunidad cómo logramos abrir la puerta de las oportunidades de manera colectiva. Ahí reafirmé la necesidad que tenemos de dialogar entre diferentes para lograr un cambio sin odio y sin miedo. ",28-02-2022
1497978726197383177,sergio_fajardo,"Gracias por la confianza, Manuela. Lo que hay en Colombia es talento. Y en mi gobierno vamos a desarrollar todas las oportunidades para que las mujeres y los jóvenes puedan brillar. La educación es la revolución. ",27-02-2022
1497743328263159810,sergio_fajardo,"Gran final de jornada en Sabaneta volanteando con @AlderConcejal. ¡Muchas personas se unieron al recorrido ratificando que la calle es nuestra sede!

 ",27-02-2022
1497706811784323074,sergio_fajardo,"Nos reunimos con @ChechyMurillo, @JuanDRiosCamara, @LeonBedoya y @BereniceBedoya1 de la ASI para conversar sobre los retos que tenemos en Antioquia. Muchas gracias por su apoyo. Colombia y Antioquia van a cambiar. ",26-02-2022
1497693797018488848,sergio_fajardo,@mariovalencia01 @MabelLaraNews @YitcyBecerra @JenniferPedraz @DianaRodrigUrib @DaniQuinonez110 @AlealSenado84 Muchas gracias Mario por tu apoyo!,26-02-2022
1497626051589152773,sergio_fajardo,Ituango debe volver a ser fuente de buenas noticias: los proyectos agrícolas y los procesos educativos y culturales que construimos hace años son muy valiosos. Aquí hay talento de sobra para que vuelva a brillar como antes. ,26-02-2022
1497598132586229765,sergio_fajardo,"Aquí estoy en Ituango, con la conciencia tranquila porque se demostró lo que siempre dije: que no soy responsable del accidente de Hidroituango, y la comunidad lo sabe. Escuchamos y hablamos sobre la transformación social que logramos aquí desde la Gobernación de Antioquia. ",26-02-2022
1497358889368662017,sergio_fajardo,"Quedan 16 días para las elecciones y vamos a estar en la calle con la gente, demostrando que con educación todo se puede.

 ",25-02-2022
1497314503465254913,sergio_fajardo,"Corrección: no he dicho lo que anuncian. Dije que primero me reuniré con mis compañeros de coalición, conversamos entre nosotros. Estoy en Medellín repartiendo volantes. Gracias por la atención. ",25-02-2022
1497287510757720064,sergio_fajardo,"Seguimos recorriendo las calles de Medellín. Nos vemos para explicarles cómo vamos a cambiar a Colombia. Lo hicimos aquí, lo hicimos en Antioquia y lo vamos a hacer en todo el país.

 ",25-02-2022
1497260484097200137,sergio_fajardo,"Ayer en Medellín nos reencontramos con amigos y repasamos algunas cosas que logramos juntos. Este es un balance de la jornada.

 ",25-02-2022
1497238988423405601,sergio_fajardo,"Me alegra trabajar con personas que hacen una política limpia y transparente como @luisferacademic, quien está comprometido con Cúcuta, Norte de Santander y Colombia. Seguimos adelante con la educación como apuesta de transformación social. ",25-02-2022
1497185824651288610,sergio_fajardo,"Vamos a demostrar los intereses oscuros detrás de la investigación de la Fiscalía Barbosa. Tenemos claridad de los lazos entre Luis Pérez, Pipe Córdoba y el encarcelado ex fiscal anticorrupción, Gustavo Moreno, para sacarme de la política.

",25-02-2022
1496998042930757632,sergio_fajardo,"Estuvimos en Belén la Palma hablando con la gente. Me alegró ver tantas caras conocidas. Sentí el aprecio de las personas que reconocen el trabajo que hicimos años atrás. Colombia va a cambiar y Medellín volverá a brillar.

 ",24-02-2022
