id,user,text,date
1589279726555701248,sergio_fajardo,Aquí pueden verla: ,06-11-2022
1589279722755612673,sergio_fajardo,"Qué pienso del presidente @petrogustavo, de su equipo de gobierno, de la  #ReformaTributaria, de la@#PazTotal, la @CoaliEsperanza, las elecciones del 2023. Acá están mis respuestas. Les comparto la entrevista con @JuanDiegoAlvira en @RevistaSemana. ",06-11-2022
1589263013093478401,sergio_fajardo,"Nunca nos debe dar pena hablar, ni luchar, por valores y principios. Escuchen a Obama. ",06-11-2022
1588532291487559681,sergio_fajardo,Merecido Jorge. Siempre felicitaciones ,04-11-2022
1587042898058612736,sergio_fajardo,Ganó Lula: gran alivio!. Sobrevive la democracia. Ahora veremos cómo es el nuevo Lula que ha superado calamidades e infortunios. Esperamos un hombre sabio que una un país desgarrado por la barbarie de Bolsonaro. Y que no olvide la lucha contra la corrupción.,31-10-2022
1586843650335674375,sergio_fajardo,Gracias Linda. Así lo vimos y sentimos. Sigan adelante. ,30-10-2022
1586035285900476416,sergio_fajardo,Más violencia ciudadana... ,28-10-2022
1585972320786518019,sergio_fajardo,Otra enferma. El pan de cada día ,28-10-2022
1585964006472552449,sergio_fajardo,"Matoneo, bullying, el pan de cada día en nuestros colegios. Empeorando. La salud mental de Colombia está seriamente averiada. URGENTE. 
",28-10-2022
1585950383293157376,sergio_fajardo,"El personaje de este vídeo está enfermo. Uno entre muchos. En Colombia avanza a pasos agigantados la enfermedad de la violencia ciudadana. Alimentada por la rabia, que hunde sus raíces en la polarización, si no le ponemos pronto atención a la cultura ciudadana no habrá paz alguna ",28-10-2022
1585430461240995840,sergio_fajardo,"Hoy me llegaron estas dos imágenes. Por algo será😇. Un saludo muy especial para Antanas Mockus quien hace mucha falta, en especial estas épocas cuando la cultura ciudadana no se menciona: precisamente cuando más la necesitamos. Feliz noche. ",27-10-2022
1585241121457725440,sergio_fajardo,Gol de García ,26-10-2022
1585230302947213312,sergio_fajardo,"URGENTE. La educación necesita atención. URGENTE
60 % de los colombianos cree que sus hijos olvidaron lo aprendido por pandemia ",26-10-2022
1585113195395416064,sergio_fajardo,"1. El impuesto a las pensiones altas era y es correcto.El argumento que en su momento dio el ministro Ocampo era y es corecto
2. La eliminación en forma progresiva del servicio militar obligatorio y la creación del servicio social que proponen De la Calle y Carvalho es correcto.",26-10-2022
1585086487250751488,sergio_fajardo,Gobernar es educar. El primer educador del país es hoy el presidente Petro. El ejemplo que con sus actuaciones diarias nos da tiene impacto directo en espíritu de la nación. Así no irá... ,26-10-2022
1585085643406725120,sergio_fajardo,Entrada libre. Este viernes invitados a conversar y discutir sobre el rumbo del país. Librería Wilborada 1047 en Bogotá. Nos vemos ,26-10-2022
1584859889695789057,sergio_fajardo,"URGENTE. En medio de la indigestión-confusión temática diaria, la educación queda relegada. URGENTE revisar el impacto de la pandemia en la generación de niñas, niños y jóvenes que vieron afectada su formación. Si no actuamos ya, los costos los pagaremos en pocos años. URGENTE. ",25-10-2022
1584526732224516096,sergio_fajardo,"Este artículo de Max Yuri Gil plantea un tema indispensable para la construcción de la paz en Colombia: la paz urbana. No se menciona y merece ser tenido en cuenta. Dice con razón: ""la paz total deberá tener un alto componente de paz urbana o no será"".
",24-10-2022
1584264315091443712,sergio_fajardo,"¿Ya votaron por Linda Caicedo? Como muchas cosas por cambiar en Colombia, una es comenzar a reconocer nuestros deportistas aquí y no esperar que los reconocimientos lleguen solo de afuera. Algunos dirán que es amateur, yo la veo como una profesional y ejemplo para nuestro país. ",23-10-2022
1582096472996474880,sergio_fajardo,"El futuro energético de Colombia está en la cuerda floja. Suspender la exploración de petróleo y gas es un error garrafal. No le hagan eso a Colombia. Un poco de sensatez, por favor. 
",17-10-2022
1580653131309846528,sergio_fajardo,"De Juan Gabriel Vásquez. El discurso y la drogas. 
",13-10-2022
1580215462264467457,sergio_fajardo,"Nada de sorpresas en la política que vemos a diario. En pocas líneas @antonigr, destacado asesor, explica la esencia de la polarización. Miren. Está estudiado. ",12-10-2022
1579556051304620032,sergio_fajardo,"@QuinteroCalle prometió transformación y trajo mentira, trampa y engaño. La corrupción total. Un daño incalculable. 2023 no puede reducirse a ""sacar"" a Quintero y a su banda. #Medellín necesita una alternativa política con una nueva visión de ciudad. ",10-10-2022
1579517538534584322,sergio_fajardo,"@QuinteroCalle prometió transformación y trajo mentira, trampa y engaño. La corrupción total. Un daño incalculable. 2023 no puede reducirse a ""sacar"" a Quintero y a su banda. #Medellín necesita una alternativa política con una nueva visión de ciudad. ",10-10-2022
1579246218550865920,sergio_fajardo,"Tras 2 meses, Petro gobierna como si todavía fuera candidato presentando propuestas sin rigor. Vamos sin un norte claro, llenos de incertidumbres hacia la polarización total. Hay avances en temas tributarios y agrarios, pero si no corrige, no habrá cambio. ",09-10-2022
1578881692668133376,sergio_fajardo,Solidaridad con nuestros compatriotas del archipiélago de San Andrés y Providencia. Energía positiva para acompañarlos en este momento.,08-10-2022
1578695955930820608,sergio_fajardo,,08-10-2022
1578692588265099264,sergio_fajardo,"Excelente escrito de Pascual Gaviria sobre el alcalde de Medellín Daniel Quintero a quien describe de forma precisa y contundente. El Alcalde y su banda han hecho y deshecho en la ciudad. Falta un año todavía y pueden hacer cosas peores. Alerta Medellín.
",08-10-2022
1578513855222714368,sergio_fajardo,"Claro que debemos caminar rápido hacia la transición energética, pero decir que no habrá nuevos contratos de exploración y explotación es errado. Hay que partir de la ciencia, el cuidado ambiental y la perspectiva económica actual. Las afirmaciones improvisadas son irresponsables",07-10-2022
1578191552232714240,sergio_fajardo,"La corrupción, ""misteriosamente"", ha desaparecido de la discusión nacional. Pero por más que se quiera mirar para otro lado los eventos en la alcaldía de Cali nos recuerdan que la corrupción es el gran problema nacional. Y en Medellín... ",07-10-2022
1577439191256162304,sergio_fajardo,"El profesor Julián leyó esta bonita semblanzas el entierro  del Profesor Vasco. Qepd
",04-10-2022
1575314276151173127,sergio_fajardo,El Padre Vasco era un PROFESOR. De los que por siempre hacen falta. Qepd. ,29-09-2022
1575205581367169024,sergio_fajardo,"La lucha contra la corrupción parece que ""pasó de moda"". No se menciona por lado alguno. Ese es ""el sapo"" que,dicen, ""toca tragarse"" para lograr el cambio. Con corruptos a bordo, no ha habido ni habrá cambio. Esto apenas comienza. ",28-09-2022
1575138906806304768,sergio_fajardo,"Los santos también van a la cárcel en Nicaragua.
",28-09-2022
1574233213488070656,sergio_fajardo,Sigue vigente. Otra semana de desorden e incertidumbre ,26-09-2022
1573774284161523712,sergio_fajardo,,24-09-2022
1573740209199616000,sergio_fajardo,"Federer y Nadal son un ejemplo notable de algo muy escaso en estos tiempos, en particular en política: pudieron ser diferentes sin ser enemigos. Rivales siempre y sin descanso: ""a muerte"". Se reconocieron, respetaron, con empatía y solidaridad. Dignidad.
",24-09-2022
1573110117603876864,sergio_fajardo,@wilmeralc_ Saludos Wilmer! Gracias por el buen recuerdo,23-09-2022
1571482610169434113,sergio_fajardo,"¿Qué pasa después de 3 meses de elegido @petrogustavo? Crecen el desorden y la incertidumbre. Cada día tenemos una ""propuesta sorpresa"" del presidente y la polarización se vislumbra. Se puede corregir pero no olvidemos: “toda situación puede empeorar” ",18-09-2022
1570649553057218560,sergio_fajardo,Unos consejos muy elementales del Profesor Feynman.  Pueden serles muy útiles a varias personas que se destacan hoy en el panorama nacional. Se los recomiendo. Feliz viernes. ,16-09-2022
1570267035979980802,sergio_fajardo,El clientelismo en los tiempos del cambio ,15-09-2022
1569687508056694785,sergio_fajardo,"Hasta luego campeón. Qepd.
Efraín ‘Zipa’ Forero, primer campeón de la Vuelta a Colombia, falleció ",13-09-2022
1569678500537286656,sergio_fajardo,Así es. Por eso los corruptos necesitan cooptar los organismos de control. La probabilidad de que los descubran es casi cero. Ahí está el negocio. ,13-09-2022
1569641051488669696,sergio_fajardo,"Que en paz descanse!. Nos hará falta: una magnífica persona. Alegre, comprometido y leal. Gracias Johan. Muchas gracias por la compañía de todos estos años. ",13-09-2022
1569415069229846530,sergio_fajardo,Barranquilla está en serios problemas con la violencia y la inseguridad. Atención urgente. ,12-09-2022
1568959828097404931,sergio_fajardo,"Con el maestro Leonardo García, del colegio rural San Jorge de Zipaquirá, en el Alto de Canicas entre Subachoque y Tabio. Siempre un maestro y la compañera inflatable: la cicla. ",11-09-2022
1568674674661531648,sergio_fajardo,"Siempre es saludable escuchar la voz del expresidente de Chile, Ricardo Lagos. La experiencia no se improvisa. 
",10-09-2022
1568367457248714753,sergio_fajardo,"Me voy agradecido con la oportunidad de visitar Dibulla, conocer maestros y maestros comprometidos con la educación, y compartir con niños y jóvenes llenos de esperanza. #LaEducaciónEsLaRevolución ",09-09-2022
1568241805329661963,sergio_fajardo,"Desde Dibulla, Guajira. Feliz de volver a los lugares que le dan propósito a la vida: las escuelas. Les estaré contando más de estos días maravillosos y rodeado de personas que están convencidas de que #LaEducaciónEsLaRevolución ",09-09-2022
1568190369950535684,sergio_fajardo,"En Dibulla, Guajira. Hoy en el Foro de Educación. Buen día ",09-09-2022
1567866023499497472,sergio_fajardo,"De la forma como se llega al poder, así se gobierna. Falta mucho por ver...",08-09-2022
1567686853154820096,sergio_fajardo,"Luis Gilberto Murillo embajador de Colombia en EEUU. Excelente nombramiento. Conozco a Luis Gilberto y tiene las condiciones para liderar la relación más importante y estratégica para Colombia. Conocimiento, rigor, seriedad y discreción lo caracterizan. Colombia en buenas manos. ",08-09-2022
1567317210267324416,sergio_fajardo,"Todos y todas coincidimos en una cosa, #LaEducaciónEsLaRevolución. Y para ustedes, ¿qué significa educación? Esto me dijeron los maestros de @CosmoSchools ",07-09-2022
1567145087078916099,sergio_fajardo,"Las flores de Alex. Honorable senador.
",06-09-2022
1566741259288551426,sergio_fajardo,"""Genio y figura hasta la sepultura..."". 
No tengamos dudas: Chile y Colombia quieren, necesitan y van a cambiar. No hay reversa, pero se necesitan seriedad, sensatez y rigor. Condiciones que no generan muchos emociones pero son fundamentales para liderar el cambio ",05-09-2022
1566474500228759552,sergio_fajardo,@petrogustavo sigue disfrutando la luna de miel del triunfo sin hacer transición de candidato que hace promesas improbables a ser líder de gobierno. Su equipo avanza sin prioridades y sin una narrativa que dé identidad a esta admon. Esa es la lección del mes del nuevo gobierno. ,04-09-2022
1566156160171900930,sergio_fajardo,@CosmoSchools gracias por este espacio!,03-09-2022
1566155432254660610,sergio_fajardo,"La educación es la verdadera revolución. Estuve en Bello, la primera parada de varias en mi compromiso con hacer de la educación la base del cambio en Colombia. ",03-09-2022
1565836772751413250,sergio_fajardo,Dolorosas imágenes llegan del Huila donde asesinaron en una emboscada a 8 policías. Mis más sentidas condolencias a sus familiares. Urge que se conozcan y condenen a los responsables de este acto terrorista. Triste viernes para el país.,02-09-2022
1565750881005584384,sergio_fajardo,,02-09-2022
1565631348886347777,sergio_fajardo,"Una columna muy bonita de Ricardo Silva en reconocimiento de su maestro, Pompilio Iriarte. Nunca olvidemos a los Pompilios que todos hemos encontrado en un salón de clase y que nos han cambiado la vida.  ",02-09-2022
1565508300933931011,sergio_fajardo,"Conozco y he trabajado con Alberto Lara quien lideró la construcción de nuestra propuesta de seguridad. Es una persona seria y razonable, que hace las cosas bien. Muy buen nombramiento. ",02-09-2022
1565390408225640448,sergio_fajardo,"Alcalde, es una batalla difícil, pero no desista. Ellos saben lo que hacen, tienen todo tipo de ""armas"" y están dispuestos a todo con tal de recuperar  su poder corrupto. Manténgase firme, no se asuste; somos muchas las personas que creemos en usted y lo apoyamos. No está solo. ",01-09-2022
1565297294777393153,sergio_fajardo,"Repetir, repetir y repetir: es urgente atender los efectos negativos de la pandemia en el sistema educativo. En particular, las pérdidas en matemáticas y lecto-escritura. Emergencia Nacional.

The Pandemic Erased Two Decades of Progress in Math and Reading ",01-09-2022
1565123001158336513,sergio_fajardo,"Leonardo Padura acaba de publicar una nueva novela, ""Personas Decentes"". En entrevista en el periódico El País nos cuenta su definición de decencia. En estos tiempos la decencia es cada dia más escasa: no es viral. Así vamos. ",31-08-2022
1565115451813908480,sergio_fajardo,Carta a mi hije ,31-08-2022
1564974023116734464,sergio_fajardo,"En Cúcuta y N. de Santander hay una lucha frontal contra el poder corrupto que ha liderado por años el exalcalde Ramiro Suárez. Hoy utilizan todos los medios para recuperar el poder y, con su contralor de bolsillo, quieren sacar al alcalde Jairo Yáñez. Respaldo al alcalde. ",31-08-2022
1564283023096414208,sergio_fajardo,Un problema matemático para empezar la semana en buena tónica. ,29-08-2022
1564058463495503873,sergio_fajardo,"No fue un accidente, es la posición oficlal, deliberada: Colombia no condena la aberrante y sistemática violacion de los derechos humanos en Nicaragua. Aberrante. Vergüenza ",29-08-2022
1562610555109933056,sergio_fajardo,Felicitaciones Arturo. A lucirte. ,25-08-2022
1562594211269988352,sergio_fajardo,"""La descalificación es el medio que emplea el mediocre para sentirse sabio""... ",25-08-2022
1561864165538631680,sergio_fajardo,"La verdad y la decencia siempre salen adelante, aunque a veces se demoren. Todavía falta, pero cada día más cerca... ",22-08-2022
1561693591361257474,sergio_fajardo,Valen 600 millones de pesos las casas que construyeron en Providencia? Robaron en la reconstrucción? El presidente Petro sembró la duda. No conocemos su política anticorrupción. Acá propongo unas acciones concretas. La primera: un libro blanco sobre lo que recibieron. Se puede. ,22-08-2022
1561674967422566401,sergio_fajardo,"Para empezar la semana: ""Así daña la justicia un juez corrupto"". De esto poco se habla pero es el peor daño que hace la corrupción. Igual vale, en lugar de un juez, para un contralor, un procurador o un fiscal corrupto. Saben muy bien dónde infiltrarse.
",22-08-2022
1561510423781834752,sergio_fajardo,"Atención. Emergencia Nacional: urgente atender los efectos negativos de la  pandemia en el sistema educativo. Los costos para niños, niñas y jóvenes si no se atienden los afectarán el resto de la vida. ",22-08-2022
1561324488549089286,sergio_fajardo,"El doctor Andrés Aguirre, un muy buen ser humano que deja una huella invaluable en Medellín.
",21-08-2022
1561187315199926273,sergio_fajardo,"Una mujer extraordinaria. Patricia Tobón Yagarí. 
",21-08-2022
1561021814628810752,sergio_fajardo,"En Cartagena, una librería preciosa: Ábaco Libros y Café.
No se la pierdan. ",20-08-2022
1560416028286455821,sergio_fajardo,"Después del lamentable episodio de la elección del Contralor por parte del Congreso, @CarlosHernanR1 tiene el gran reto de demostrar independencia y transparencia. El cambio sin lucha frontal contra la corrupción nunca será cambio. ",18-08-2022
1560259843503570944,sergio_fajardo,"El nombramiento de Jorge Iván González en la dirección de Planeación Nacional es un acierto. Garantía de conocimiento, rigor y seriedad. Junto con José Antonio Ocampo harán una llave con experiencia y sensatez.",18-08-2022
1560239928012902400,sergio_fajardo,"Las luchas de Luis Carlos Galán no terminan: contra el clientelismo y la corrupción, por la educación, etc. Mucha falta ha hecho, y hace. ""A los hombres se les puede eliminar pero a las ideas no"". ",18-08-2022
1560057879813656577,sergio_fajardo,A Nairo le creo ,18-08-2022
1560056102154272769,sergio_fajardo,"La persona que dirija la @CGR_Colombia es fundamental para luchar contra la corrupción. No puede tener precio:debe ser una persona pulcra, decente, transparente con conocimiento de las finanzas del estado. No podemos repetir lo que ocurrió en los últimos 4 años en la #Contraloria ",18-08-2022
1559867095139160071,sergio_fajardo,"Lectura obligada para estos nuevos tiempos: LLEGAR A TIEMPO.
Llegar a tiempo ",17-08-2022
1559760544093163520,sergio_fajardo,¿Y la educación básica? ,17-08-2022
1559711689611874304,sergio_fajardo,Esperamos poder volver a contar con la presencia y sabiduría de @DeLaCalleHum. Faltan muchas discusiones que dar y necesitamos su sabiduría y cordura en estos tiempos.,17-08-2022
1559560595430690817,sergio_fajardo,"Acá está el nudo gordiano: campeones en jóvenes que no estudian, trabajan o reciben entrenamiento. Es muy grave.
Quién está a cargo de este tema? ",16-08-2022
1559493932391825408,sergio_fajardo,"Salen los resultados de las Pruebas Saber, hablamos de ello uno o dos días y en eso nos quedamos. Los resultados en matemáticas son un reflejo de lo que sucede en las demás áreas del currículum educativo, un problema silencioso con efectos negativos en el desarrollo del país.",16-08-2022
1559493929426370561,sergio_fajardo,La calidad de la educación en Colombia sigue por debajo de niveles adecuados. @agaviriau tiene un gran reto que podría acompañar con una persona como @MantillaIgnacio para dar a las matemáticas la importancia en el desarrollo de los niños y jóvenes. #LaEducaciónEsLaRevolución ,16-08-2022
1559218250457571330,sergio_fajardo,"No lo insulten. No importa cuales sean sus creencias políticas, Egan es un super-berraco, admirable. Ánimo que todavía quedan muchos premios de montaña por escalar y etapas por ganar. ",15-08-2022
1558875032348233728,sergio_fajardo,"La posición de Colombia frente a la situación en Nicaragua, al abstenerse de condenar la aberrante y violación sistemática de derechos humanos del gobierno de Ortega, es una gran vergüenza. Así no. ",14-08-2022
1558786907601080320,sergio_fajardo,"""El reto: que restablecer las relaciones con Venezuela no sea solo para la foto"": excanciller Holguín | EL ESPECTADOR ",14-08-2022
1558413583469494272,sergio_fajardo,Gran persona y gran economista: así de fácil es describir a Gonzalo. Excelente nombramiento. ,13-08-2022
1557943354863898629,sergio_fajardo,"Cae la noche, y la ciencia al garete, es la cenicienta. Se busca ministro o ministra.",12-08-2022
1557723045078474752,sergio_fajardo,Desde que tengo conciencia (hace muchos años) soy hincha del poderoso @DIM_Oficial. Quiero y querré a mi equipo por siempre. Germán Ezquiel Cano es uno de esos jugadores que está y quedará en el corazón por siempre. ,11-08-2022
1557523553116995584,sergio_fajardo,"@HoracioJSerpa Gracias @HoracioJSerpa. Un gusto encontrarnos de nuevo, la admiración es mutua.",11-08-2022
1557168601244778497,sergio_fajardo,Designar un gabinete es un acto fundamental para un gobernante que define su capacidad para liderar. Preocupa que el presidente Petro haya nombrado a varias personas que no conoce o no tienen experiencia en el sector nombrado. Suscita dudas y es un complejo punto de partida. ,10-08-2022
1556351178207858688,sergio_fajardo,"Un saludo para @petrogustavo. Mis mejores deseos para su gestión en los próximos 4 años. Colombia cambió, y usted y su equipo son los encargados de entender los dolores de un país que necesita sanar. ",07-08-2022
1556031113872687107,sergio_fajardo,Aurora Veragra: gran nombramiento. Éxitos. ,06-08-2022
1555617973381042176,sergio_fajardo,En la gobernación con el programa anticorrupción Antioquia Legal implementamos lo que llamas lugares comunes. Eso generó transparencia y por ende confianza en el gobierno departamental. Acá dejo el link del plan de gobierno por si te interesa: Feliz tarde.,05-08-2022
1555617872763813888,sergio_fajardo,Gracias @ClaMoralesM por leerme. El problema precisamente es pensar que la corrupción es un lugar común o inherente a la política. Por eso necesitamos conocer cómo pretende el gobierno Petro luchar contra este cáncer. Sin esa lucha no habrá cambio. ,05-08-2022
1555356369330511877,sergio_fajardo,Reitero: ningún gobierno logrará un cambio si no apuesta decididamente por luchar contra la corrupción. No conocemos la estrategia del presidente @petrogustavo para enfrentar este flagelo. Propongo acciones concretas para iniciar ese cambio que el país reclama. ,05-08-2022
1555315171052118017,sergio_fajardo,"""Quiero la paz total, pero no de afán"". Hay lecciones que no hemos discutido sobre lo que pasó en el acuerdo con las Farc. En particular, por que ganó el No.Necesitamos una pedagogía especial para que entendamos que la paz es de todos, con todos y sin afán ",04-08-2022
1555162463754133504,sergio_fajardo,Cada día más vigente. En el Congreso de la República se libra la principal batalla contra la corrupción. La película no pinta nada bien. El presidente Petro tiene la palabra. ,04-08-2022
1555134530465447937,sergio_fajardo,"¡Felices 103 años, don José María! El decano de la industria paisa sigue creando desde su oficina en Haceb ",04-08-2022
1554626881122623489,sergio_fajardo,Estoy totalmente de acuerdo. ,03-08-2022
1553933462985392129,sergio_fajardo,José Antonio Ocampo: 'No voy a proponer locuras ni voy a aceptar locuras' ,01-08-2022
1553758389439717377,sergio_fajardo,"Medellín, en picada
",31-07-2022
1553110124314693634,sergio_fajardo,Colombia votó por el cambio esperando una lucha frontal contra la corrupción. Elegir un contralor independiente y cualificado es el primer paso para que @petrogustavo le cumpla al cambio. Tiene las mayorías. ¿Tiene la voluntad política? ,29-07-2022
1552805248573612032,sergio_fajardo,,28-07-2022
1552802338426978304,sergio_fajardo,Sigue vigente... ,28-07-2022
1552671794208935936,sergio_fajardo,"Juan Esteban Constaín, una bonita despedida a Ernesto Guhl: adiós a un sabio  vía @eltiempo",28-07-2022
1552066912804388864,sergio_fajardo,"Análisis del Profesor De Zubiría sobre la educación que entrega el gobierno Duque. Lectura obligada, nos dice""...el efecto de todo esto ha sido que los maestros pierdan la esperanza. Ellos ya no  creen que sea posible mejorar la calidad en la escuela"". 
",26-07-2022
1551896157378453505,sergio_fajardo,"Ernesto Guhl, otro amigo que se adelanta y deja un gran vacío entre quienes lo conocimos. Q.E.P.D. ",26-07-2022
1551740662143393792,sergio_fajardo,"Solidaridad con las familias de lo(a)s policías asesinado(a)s: crecimos en la barbarie de los planes pistola y todavía hacen parte de nuestras vidas, no hemos sido capaces de superar la barbarie. Qué tristeza y qué vergüenza. Paz en sus tumbas. ",26-07-2022
1551699200143917061,sergio_fajardo,"Este señor es un ejemplo de resiliencia, dignidad, inteligencia y decencia!
Juan Daniel Oviedo: 'Mi mamá no me perdona que yo sea gay' ",25-07-2022
1551329659270348800,sergio_fajardo,"Patricia Tobón Yagari, la hija de mis amigos - Infobae ",24-07-2022
1550895404509810690,sergio_fajardo,"Alonso Salazar es un amigo y compañero, conocedor como el que más de las entrañas de Medellin. Con el recorrí la ciudad y aprendí a entender la profunda dimensión de sus problemas sociales. Siempre honesto y brillante, le debemos mucho. Yo creo en Alonso.
",23-07-2022
1550257703955701760,sergio_fajardo,"Daniel, Humberto, Jennifer, Julia y Juan Sebastián. Excelente grupo de nuevos, nuevas, congresistas: calidad en todos los sentido. Seguro que se van a lucir. Suerte! ",21-07-2022
1550106792012685314,sergio_fajardo,Lánguido Hassan ,21-07-2022
1549904377879592960,sergio_fajardo,Lánguido Duque ,20-07-2022
1549847740863111173,sergio_fajardo,"Siempre independiente querido Antonio. Recuerda la fórmula: coherencia+consistencia=confianza. A propósito, en que estás en desacuerdo con mi texto? Feliz tarde. ",20-07-2022
1549633842553786369,sergio_fajardo,"La educación, el empleo y el Sena  vía @larepublica_co",20-07-2022
1549550645404999684,sergio_fajardo,"Ahora la política es “el arte de tragar sapos” por doquier, se dice que es dinámica y cuando alguien se atreve a hablar de principios le descalifican por una supuesta superioridad moral. Este 20 de julio se acaba la luna de miel y empieza en firme la era Petro. ",20-07-2022
1549210942491295750,sergio_fajardo,"Jorge se te olvida la inversión que hicimos en mi periodo como alcalde entre 2004 y 2007. De lejos, la inversión más importante en la historia de la educación en Medellín. ",19-07-2022
1548864542138142721,sergio_fajardo,,18-07-2022
1548631033733685250,sergio_fajardo,Excelente artículo.  ,17-07-2022
1547985234536255493,sergio_fajardo,"Este artículo de Moisés Wasserman, sobre el programa de Ciencia y Tecnología del Pacto Histórico de Petro, es certero. Vale la pena leerlo ",15-07-2022
